video_id,title,publish_time,channelId,channel_title,category_id,trending_date,views,likes,comment_count,comments_disabled,ratings_disabled,description
bsi8_9EoYyg,"Kisi Ka Bhai Kisi Ki Jaan - Official Trailer | Salman Khan, Venkatesh D, Pooja Hegde | Farhad Samji",2023-04-10T13:05:19Z,UCz3Mq_cS7AVRatrpGQi7QUQ,Salman Khan Films,24,23.27.04,48082048,899742,71919,False,False,"Bhaijaan has arrived! This Eid, celebration will be double with lots of drama, action, masti and Salman Khan. Presenting the dhamakedaar trailer of Kisi Ka Bhai Kisi Ki Jaan. Releasing in theatres on April 21st, 2023.#KisiKaBhaiKisiKiJaan #SalmanKhan #VenkateshDaggubati #PoojaHegdeSalman Khan Films in Association With Zee Studios.ЁЯОм Movie Credits: Directed by Farhad SamjiProduced by Salma KhanDirector of Photography: V. ManikandanAssociate Producer: Shamiraah NambiarMusic: Himesh Reshammiya, Ravi Basrur, Sukhbir Singh, Devi Sri Prasad, Sajid Khan, Payal Dev, Amaal MallikMusic Background Score & Sound: Ravi Basrur Action Director: Anl Arasu Editor: Mayuresh SawantProduction Design: Rajat Poddar Costume Design: Ashley Rebello and Alvira Khan Agnihotri, Sanam Ratansi and RochelleRavi Basrur Trailer Music Team:Music Producers: Ravi Basrur, Bharath Madhusudhanan, Sachin Basrur, Chethan HandattuSound Effects: Nandhu J K.G.FFemale Opera Vocal: Supriya RamEnglish Rap Solo Female: Aira UdupiEnglish Rap Solo Male: RO Raper BangaloreEnglish Rap Lyrics: Karthik GubbiHonting Gibrish Vocal Male: Rama Krishna BasrurViolin: Sandilya PisapatiSingers: Santhosh Venky, Ravi Basrur, Sachin Basrur, Manish DinakarIN-House Singers A: Aira Udupi, Suchetha Basrur, Vijayalaxmi Mettinahole, Charitha C Molahalli, Nisha kanchugodu, Shreya kanchugoduAkshata Gangolli, Spurthi KundapuraIN-House Singers B: Krishna Basrur, Nagaprakash Kota, Vijay Basrur, Chethan Handattu,Krishnamurthy Basrur, Poorna BasrurStereo Mixed & Mastered By: Ravi BasrurMusic Mix & Mastered @ Ravi Basrur Music & Movies BASRUREnjoy & stay connected with us!тЦ║Subscribe to SKF: http://bit.ly/SKFYouTubeтЦ║ Like us on Facebook: https://www.facebook.com/SKFilmsOfficialтЦ║ Follow us on Twitter: https://twitter.com/skfilmsofficialтЦ║ Follow us on Instagram: https://www.instagram.com/skfilmsofficial/"
cPdHHcILGQs,рд░рдмреАрд▓рд╛рдЗ рдШрд░рджреИрд▓реЛрдорд╛ рдиреЗрдкрд╛рд▓реА рд╣реЛрдЗрдиреМ рднрдиреНрджреИ рдерд░реНрдХрд╛рдПрдкрдЫрд┐ - рд░рдмреАрд▓реЗ рдЧрд░реЗ рджреБрдИ рдорд┐рдиреЗрдЯрдорд╛ рдмреЛрд▓рд┐ рдмрдиреНрдж рдкрд╕рд▓ рдирдХрд▓реА рднрдПрдХреЛ рдкреНрд░рдорд╛рдг,2023-04-12T07:15:20Z,UCmParc4a14EKrENcME-9OOA,Smart TV,25,23.27.04,626172,16896,3276,False,False,рд░рдмреАрд▓рд╛рдЗ рдШрд░рджреИрд▓реЛрдорд╛ рдиреЗрдкрд╛рд▓реА рд╣реЛрдЗрдиреМ рднрдиреНрджреИ рдерд░реНрдХрд╛рдПрдкрдЫрд┐ - рд░рдмреАрд▓реЗ рдЧрд░реЗ рджреБрдИ рдорд┐рдиреЗрдЯрдорд╛ рдмреЛрд▓рд┐ рдмрдиреНрдж рдкрд╕рд▓ рдирдХрд▓реА рднрдПрдХреЛ рдкреНрд░рдорд╛рдг****************************************************************************Interview With Rabi lamichhaneHost - Jevish PoudelCamera - Shalik Ram NeupaneEdit - Jevish PoudelSmart TV - 9843934560Smart TV Smart_TV******************************************************************Subscribe ushttps://www.youtube.com/smarttv1@SMARTTV1 Smart TV #Smart_TVLike us onFacebook:https://www.facebook.com/esmartkhabarOfficial Website: https://esmartkhabar.com/┬йSmart TVSmart TV is authorized to upload this video. Using of this video on other channels without prior permission will be strictly prohibited. (Embedding to the websites is allowed)#Rabilamichhane #smart_tv
b9Hb6F3Iyy0,Granny wants to sleep!!! #shorts,2023-03-27T10:00:32Z,UCZm-kThz415-1HG9LUP0HQg,Mihdens,20,23.27.04,98694168,1039530,474,False,False,Original Animation Mihdens
-kHsXtHs6fM,Naagin 6 | рдирд╛рдЧрд┐рди 6 | Episode 124 | 22 January 2023,2023-04-22T21:15:00Z,UC55IWqFLDH1Xp7iu1_xknRA,Colors TV,24,23.27.04,2610748,54156,963,False,False,"Naagin 6 | рдирд╛рдЧрд┐рди 6 | Episode 124 | 22 January 2023Takshak Naag informs Prathna that her other daughter will appear in Naagin form on her seventh birthday. However, Prathna becomes overjoyed by the news and decides to find her other daughter at all costs. Will she succeed this time?Naagin, the saga of love and revenge, sacrifice. This supernatural show traces the lives of 'ichchadhari' naagins. Watch on, as every season, the Naagin fights evil and keeps the ultimate source of power safe. Watch more videos: https://www.youtube.com/playlist?list=PLcC6hSpO26Ktuu7j_1s3Fc0lle99DksNHTo subscribe to this channel go to: http://www.youtube.com/subscription_center?add_user=colorstvFollow us on: Facebook: https://www.facebook.com/ColorsTVInstagram: https://www.instagram.com/colorstv/#ColorsTV #Naagin6 #рдирд╛рдЧрд┐рди6The accuracy, completeness, currency and/or suitability of the above video description is not endorsed by its licensor or broadcaster or the Channel. They shall not be liable for loss and/or damage arising from the video description."
1VhA9aITCGg,Where is Pushpa? | Pushpa 2 - The Rule ЁЯФе | Hindi | Allu Arjun | Sukumar | Rashmika | Fahadh Faasil,2023-04-07T10:34:58Z,UCq-Fj5jknLsUf-MWSy4_brA,T-Series,10,23.27.04,68238202,2430269,68616,False,False,"#WhereIsPushpa #Pushpa2TheRule #AlluArjunWhere is Pushpa? Pushpa 2 - The Rule - Hindi Glimpse !!!Pushpa 2 - The Rule - Written and Directed by Sukumar. Produced by Naveen Yerneni and Y. Ravi Shankar of Mythri Movie Makers in association with Sukumar Writings,  the film stars Allu Arjun, Fahadh Faasil, Rashmika Mandanna, Dhanunjay, Rao Ramesh, Suneel, Anasuya Bharadwaj & Ajay Ghosh. The film's music is composed by Devi Sri Prasad, with cinematography and editing were performed by Miroslaw Kuba Brozek and Karthika Srinivas respectively.#WhereIsPushpa #Pushpa2TheRule #AlluArjun #Sukumar #RashmikaMandanna #FahadhFaasil #DSP #MythriMovieMakers #Pushpa2 #PushpaTheRule #Pushpa #Pushpa2Teaser #Pushpa2Trailer #Pushpa2TheRuleGlimpse #HuntForPushpaMovie Details :Movie Name: Pushpa: The RuleCast:Allu Arjun, Rashmika Mandanna, Fahadh Faasil, Dhanunjaya, Rao Ramesh,Sunil, Anasuya Bharadwaj etc.Technical Team:Story- Screenplay-Direction Sukumar BandreddiProducers: Naveen Yerneni, Ravi Shankar Yalamanchili CEO: CherryMusic: Devi Sri PrasadCinematographer: Mires┼Вow Kuba Bro┼╝ekProduction Designer: S. Ramakrishna - Monica NigotreLyricist: Chandra BoseVFX Supervisor : Mike Hedayati, Kamal Kannan Editor : Ruben - Karthika Srinivas Costume Designers : Deepali Noor - Sheetal SharmaFights : Ram Laxman,Peter Hein, тАЭDragonтАЭPrakash, Kecha, NavakanthCharacter Designer : Preeti Sheel  Chief Executive Producer: KVV Bala SubramaniamExecutive Producer - Baba Saikumar MamidapalliBanners: Mythri Movie Makers in Association with Sukumar WritingsPRO: Eluru Srinu, Maduri Madhu, MeghasyamMarketing - First ShowMix Engineer - Kannan GanpatColorist - Ashwath Sound Design: Sync CinemaDI & Sound Mixing: Annapurna StudiosVisual Promotions - Ruben Trailer HouseVisual Promotion Team - Srihari & Newton Prabhu___________________________________Enjoy & stay connected with us!ЁЯСЙ Subscribe to T-Series: http://bit.ly/TSeriesYouTubeЁЯСЙ Like us on Facebook: https://www.facebook.com/tseriesmusicЁЯСЙ Follow us on Twitter: https://twitter.com/tseriesЁЯСЙ Follow us on Instagram: http://bit.ly/InstagramTseries"
gWUuY5Yln2c,рдпреЗ рдХрд░рдХреЗ рджрд┐рдЦрд╛рдУ End рддрдХ рджреЗрдЦреЛ VideoтЭдя╕ПтАНЁЯФеЁЯТкЁЯШЕЁЯШВ #funny #viral #shortvideo,2023-04-15T01:54:16Z,UCBIyn-ZVn6YhkVWF0L1lvcg,Vikram Singh Fitness,17,23.27.04,12113983,228812,49,False,False,
7_chogdf_xs,Eating Fake Fingers ЁЯШВ #prank,2023-04-18T16:00:06Z,UCVJHAwH_0nN5gqzMNjFRgGw,SKITS,24,23.27.04,8618422,180381,98,False,False,"New videos daily тЬи SUBSCRIBE for more! ЁЯМИ#Prank #Funny #Shorts_________Music from TheSoul Sound:┬аhttps://thesoul-sound.com/This video is made for entertainment purposes. We do not make any warranties about the completeness, safety and reliability. Any action you take upon the information on this video is strictly at your own risk, and we will not be liable for any damages or losses. It is the viewer's responsibility to use judgment, care and precautions if one plans to replicate.The following video might feature activity performed by our actors within a controlled environment - please use judgment, care, and precaution if you plan to replicate."
6UeLU0uWGbU,"Red (Remake Of Thadam) 2023 New Released South Hindi Dubbed Movie | Ram Pothineni, Nivetha Pethuraj",2023-04-01T04:30:10Z,UCyoXW-Dse7fURq30EWl_CUA,Goldmines,1,23.27.04,45856770,666796,14851,False,False,"Two lookalikes get embroiled in a murder investigation and become the prime suspects. However, as new facts come to light, the case gets complicated.Movie:- Red (Thadam)Starcast:- Ram Pothineni, Nivetha Pethuraj, Malvika Sharma, Amritha AiyerCreative Producer:- Manish ShahDirected by:- Kishore TirumalaMusic by:- Mani Sharma #Red #RamPothineni #NivethaPethuraj #MalvikaSharma #Thadam #Goldmines -------------------------------------For More MoviesSubscribe:@https://www.youtube.com/GoldminesTelefilmsFollow Us OnFacebook:@https://www.facebook.com/OfficialGoldminesTeleFilmsInstagram:https://www.instagram.com/officialgoldminestelefilmsTwitter:https://twitter.com/GTelefilms"
q_i3gj2zdtA,"Teri Jeet Meri Jeet, Teri Haar Meri Haar ЁЯе░ | aisa bus filmo mai hota hai ЁЯШЫЁЯШЫЁЯдг",2023-04-13T09:45:02Z,UC92EFrsOrH7oCyTjV5gG4bw,Anjali and Hunny,26,23.27.04,20496070,555973,186,False,False,"Don't Forget to LIKE, SHARE, and SUBSCRIBE Subscribe to my channelhttps://bit.ly/AnjaliandhunnyFollow me on INSTAGRAM https://www.instagram.com/sooosaute/Business enquiry : anjaliandhunny@qyuki.com"
e3MUvUjBae8,Sajjan Raj Vaidya - Aayen Ma [Official Release],2023-04-13T17:30:19Z,UClFO6ULKU2XXQ_zb76JMUPQ,Sajjan Raj Vaidya,10,23.27.04,573466,44092,2111,False,False,"You heard us, so we heard you,You called us, so we came through.тАШAayen MaтАЩ is a verse of melodies that brought you to us, and as such, brought us to you. So this is a sign of gratitude: thank you._______________________________________________________________________Official Music video for Sajjan Raj Vaidya's 'Aayen Ma'.Written | Performed | Produced by:Sajjan Raj VaidyaMixed and Mastered by:Sajjan Raj VaidyaDirection / DOP / Edit / ColorBreezendraCreative DirectorPratik ShresthaCinematographer(s)BreezendraLabesh ShresthaJaved Khan (Sydney)Aatish Regmi (Sydney)Artwork byKailash SubediStyled byMonika ShresthaProduction Manager(s)Pratik ShresthaLighting DirectorSharif ShresthaThe Project Studio TeamBinaya Man AmatyaAvishek GhalaySpecial ThanksAbhijan Chitrakar-Phnuyal Shreeya JoshiThe Project Studio NepalThe Social Lubricant Coffee CompanyA Downtown Flux and Hues Productions presentation.Visit our website: https://www.sajjanrajvaidya.com/тАЛSubscribe to Sajjan's channel: https://www.youtube.com/c/sajjanrajvaidyaWatch all of Sajjan's videos here: https://www.youtube.com/c/sajjanrajvaidya/videosFollow Sajjan on:Facebook: https://www.facebook.com/sajjanrajvaidyaтАЛInstagram: http://www.instagram.com/sajjanrajvaidyaтАЛTwitter: @sajjanrajvaidyaSoundcloud: https://soundcloud.com/sajjanrajvaidyaтАЛFollow Downtown Flux on Instagram:http://www.instagram.com/downtownfluxтАЛ┬йя╕ПSajjan Raj Vaidya 2023Unauthorized replication of any content related to this video is not allowed."
RX0F_pcI57s,Coffee Pi GayaЁЯШбЁЯТФ #shorts #trendingshorts #comedy #foodlover #viral #sandeepbhatt,2023-04-12T08:48:21Z,UCXgv6qemwooHi71a7-htxAw,Sandeep Bhatt Vlogs,22,23.27.04,12157300,673984,695,False,False,
80Ftnv4sjKI,Would you win?!ЁЯШЕ #football,2023-04-18T15:33:19Z,UCkwZ4L2z5M_nLHoPtshyJbw,ILYA BORZOV,22,23.27.04,7221501,202939,184,False,False,
nokz9WgIwjI,Scary night games with Megan | Megan robot doll scared me #shorts,2023-04-05T13:15:03Z,UCFcG7cgOd2ePKx--kPft7Kg,One More,26,23.27.04,75764550,1580303,884,False,False,"тЭдя╕П Share and subscribe if you like the videoЁЯФФ DonтАЩt forget to click the bell to make sure you never miss our videosЁЯТЫ #shorts Music by Epidemic Sound ЁЯО╡: https://www.epidemicsound.com/---------------This video is made for entertainment purposes. We do not make any warranties about the completeness, safety and reliability. Any action you take upon the information on this video is strictly at your own risk, and we will not be liable for any damages or losses. It is the viewer's responsibility to use judgment, care and precautions if one plans to replicate.The following video might feature activity performed by our actors within controlled environment- please use judgment, care, and precaution if you plan to replicate.All product and company names shown in the video are trademarksтДв or registered┬о trademarks of their respective holders. Use of them does not imply any affiliation with or endorsement by them."
wbhgmebQIBc,"Today news ЁЯФ┤ nepali news | aaja ka mukhya samachar, nepali samachar live | Baishak 12 gate 2080",2023-04-24T23:41:03Z,UC09hwXZEtHcScFWebDsj7cA,samacharpati,25,23.27.04,111912,3555,210,False,False,"Nepali news - today news | aaja ka mukhya samachar, nepali samachar live | Baishak 12 gate 2080,nepali news today, nepali news live, nepali news today live, nepali news update today, nepali news today kantipur, nepali news 24, nepali news today live tv, nepali news channel, nepali news live now, nepali news kantipur live today, nepali news 24 live, nepali news samachar, nepali news update, nepali news latest,today news, today news nepal, today news live, today news nepal live, today news nepal live, today news live nepali, today nepali news, today's news, today's nepali news, nepali samachar, nepali samachar today, nepali samachar lvie, nepali samachar news, nepali samachar aaj ka, nepali samachar nepali samachar, nepali samachar aajako nepali samachar, nepali samachar taja, nepali samachar today live, nepali samachar kantipur, nepali samachar taja khabar, nepali samachar live news, nepali samachar video, nepali samachar naya, nepali samachar today news, aaj ka mukhya samachar, aaj ka mukhya samachar live, aaj ka mukhya samachar taaja, aaj ka mukhya samachar hai, aaj ke mukhya samachar nepali, aaj ka mukhya samachar news, aaj ke mukhya samachar aaj tak, aaj ka mukhya samachar samachar, aaj ka mukhya samachar haru, aaj ke mukhya samachar live, aaj ka mukhya samachar taaja news, aaj ka mukhya samachar nepal,samachar, samachar news, samachar live, samachar samachar, samachar nepali, samachar aaj tak, samachar pati, samachar today, samachar aaj ka, samachar dijiye, samachar pati news, samachar pati news today, samachar patra, samachar song, samachar live aaj tak, nepali news,today news, samachar, news,nepali samachar,news today,nepal news,nepali news today,today nepali news,news nepal,samachar today in nepali,nepal news today,news nepali,nepal samachar,aajako taja khabar,news nepali news today,samachar nepali,aajako samachar,new nepali news,nepali khabar,nepali news live,samachar pati,news today nepal,samacharpati,samacharpati news,aaja ka mukhya nepali samachar,Fatafat taja KhabarOur Other Some Playlist.Health Tips/рд╣реЗрд▓реНрде рдЯрд┐рдкреНрд╕: ЁЯСЙ https://youtube.com/playlist?list=PLBg_ZbC3CTQ7V6kpfRfhYZiE0q2MBX4hhLatest News/рддрд╛рдЬрд╛ рд╕рдорд╛рдЪрд╛рд░ :ЁЯСЙ https://youtube.com/playlist?list=PLBg_ZbC3CTQ62ghN0iWXg-WEFF9Tz8OsjLatest Video Footage/рднрд░реНрдЦрд░реИрдХреЛ рддрд╛рдЬрд╛ рднрд┐рдбрд┐рдпреЛ рд╣реЗрд░реНрдиреБрд╣реЛрд╕ :ЁЯСЙ https://youtube.com/playlist?list=PLAsVa-hiw2gow0QqhnDncwKxZDkj9lf6MJoin Samacharpati.com on Viber :ЁЯСЙ https://invite.viber.com/?g2=AQBNmPD2z5VbzUkc2G8SbFXmsBr4aUYPnOjLHXqsV7Y6iIfPovVTnxdzQEFhfm0LLatest News : https://samacharpati.comFor Advertisements : info@samacharpati.comInstagram: https://www.instagram.com/samacharpatiFacebook: https://www.facebook.com/samacharpatiTikTok: https://www.tiktok.com/@samacharpatiTwitter: https://www.twitter.com/samacharpatiProduced By: Pokhara Media Club Pvt.Ltd/Samachar PatiPresented By: Pralhad Chandra Ghimire Video Edited By: Robart ReturnsAbout Samacharpati : ЁЯСЙ https://youtube.com/@samacharpati/about#nepalinews #aajakosamachar #todaysnews #todaynews #newsofnepal #samacharpati #samacharpatinews #todaynepalinews #news #samachar #pralhadchandraghimire #pralhad"
_Tk9_kPpO1U,Je Chhau Timi - Swoopna Suman x Samir Shrestha ( Official M/V),2023-03-25T12:15:07Z,UC68LOl1l1oLTgW22hQDcduA,Swoopna Suman,10,23.27.04,13706241,369236,10091,False,False,"#jechhautimi  #chandramapanidaaghuncha #chadrama @SamirShrestha319 Lyrics/Composition : Swoopna sumanVocals : Samir Shrestha & Swoopna SumanProduced/Mixed/Mastered by : Saswot ShresthaRecorded at : Omniphonix Studio, BalajuProject Managed by : Rashik Bhattarai ( Garage Entertainment) Video by : Stellar StudiosDirection/DOP : Nayan RaiVFX/edit : Ashok AdhikariColorist : Anjon LimbuProduction Manager : Nisim GorkhaliVideo Shot At : 5150 Studio, BalajuSubscribe to SwoopnaтАЩs channel: https://bit.ly/2E63D59subscribe to Samir's Channel : https://www.youtube.com/@SamirShrestha319/featuredFollow Samir on Instagram : https://instagram.com/samirstha319?igshid=YmMyMTA2M2Y=Listen to more of Swoopna's music on:  Spotify :https://bit.ly/SwoopnaSpotifyApple Music : https://bit.ly/SwoopnaAppleMusicAmazon Music : https://bit.ly/SwoopnaAmazonMusicTidal : https://bit.ly/SwoopnaTidalYT Music : https://bit.ly/SwoopnaYTmusicAnd, all other major streaming platforms.Follow Swoopna on Facebook: https://bit.ly/3fY0Cls                                  Instagram: https://bit.ly/2ZTqMjK┬й Swoopna Suman 2023.Any form of reproduction and distribution of this content, without the ownerтАЩs permission, is not allowed. Please mail us at swoopnasumaninfo@gmail.com for any inquiries or concerns."
SFsF-SlMGe8,Nepali Serial Juthe (рдЬреБрдареЗ) Episode 108 || April 20- 2023 By Raju Poudel Marichman Shrestha,2023-04-20T15:15:11Z,UCgJiJkUTIO0gOhsjsgGZL6Q,Master TV,24,23.27.04,1951273,51454,1055,False,False,"Master TV Presents:-Juthe is a social television serial that portrays a story about the Dalits emancipation movement against these oppression, the heroes of the movement and future vision for the emancipation. It is aired in Himalaya Television at 8:00 PM and in YouTube at 9:00 PM every Wednesday.Nepali Serial Juthe (рдЬреБрдареЗ) Episode 108 || April 20- 2023 By Raju Poudel Marichman ShresthaSpecial ThanksNarendra Shrestha (Pokhara)Kushal Thapa (Pokhara)Sharwan Shrestha (Texas America)Anjana Joshi (Texas America)Actor Rabi GiriBidhya KarkiRambabu RegmiMukunda MainaliSarmila SharmaShree Prasad ThapaRaju PoudelMarichman ShresthaRaju KarkiUjjwol KhadkaUnisha DhunganaSowinika BastolaRukmila AdhikariAnamika LamichhaneLightShiva Parajuli MusicianYogesh KajiAalap Voice : Pasang Doma Sherpa & Binay KarkiBackground Music by : Binay Karki Aarohi EntertainmentAnamnagar Ktmbinaytwo@gmail.comCamera Ghanshyam PokharelEditorRabin BhattaSub-EditorSarita  GautamAshok ChaudharyMarkup ArtistNirmala AcharyaWriter/ DirectorRaju Poudel, Marichman Shresthaрд╕рдорд╛рджрд░рдгреАрдп рджрд░реНрд╢рдХрдмреГрдиреНрджрд╣рд░реБрдорд╛ рдирдорд╕реНрдХрд╛рд░ рд╣рд╛рдореНрд░реЛ рдХрд╛рд░реНрдпрдХреНрд░рдо рдЬреБрдареЗ рдкреНрд░рддрд┐ рд╕рд╛рдорд╛рдЬрд┐рдХ рд╕рдиреНрдЬрд╛рд▓рдорд╛ рдЙрдареЗрдХрд╛ рд╡рд┐рд╡рд┐рдз рдкреНрд░рддрд┐рдХреНрд░рд┐рдпрд╛рд▓рд╛рдИ рдордзреНрдпрдирдЬрд░ рдЧрд░реНрджреИ рд╣рд╛рдореНрд░реЛ рдЯреАрдо рд░ рд░рд╛рд╖реНрдЯреНрд░рд┐рдп рджрд▓рд┐рдд рдЖрдпреЛрдЧ рд╕рдВрдЧ рдкрд░рд╛рдорд░реНрд╕ рдЧрд░реНрджреИ рдЕрдЧрд╛рдбрд┐ рдмрдвреНрдиреЗ рдирд┐рд░реНрдгрдп рднрдПрдХреЛ рдЫ ред рдпрд╕ рд╕рдордиреНрд╡рдпрдХрд╛ рд▓рд╛рдЧрд┐ рд░рд╛рд╖реНрдЯреНрд░рд┐рдп рджрд▓рд┐рдд рдЖрдпреЛрдЧ рдкреНрд░рддрд┐ рд╡рд┐рд╢реЗрд╖ рдзрдиреНрдпрд╡рд╛рдж рдЬреНрдЮрд╛рдкрди рдЧрд░реНрджрдЫреМрдВ#Juthe #JutheEpisode108 #JutheNepaliSocialSerial┬й Master TV--------------------------------------------Social Link:-YouTube:- https://tinyurl.com/ybp5lm25G+:- https://tinyurl.com/y9sc4yy4рдпрд╕ рдЪреНрдпрд╛рдирд▓ рдорд╛ рд░рд╣реЗрдХрд╛ рдЧреАрдд, рд╕рдВрдЧреАрдд рддрдерд╛ Video рд╣рд░реБ рдХрдкрд┐, Download рдЧрд░реА рдЕрдиреНрдп Channel рдорд╛ upload рдЧрд░реЗрдХреЛ рдкрд╛рдПрдорд╛ рдкреНрд░рдЪрд╛рд▓рд┐рдд рдХрд╛рдиреБрди рдмрдореЛрдЬрд┐рдо рдХрдбрд╛ рднрдиреНрджрд╛ рдХрдбрд╛ рдХрд╛рд░рдмрд╛рд╣реА рдЧрд░рд┐рдиреЗрдЫ ред  Embedding to a website is allowed."
BcOODsQBhgY,Sakambari,2023-04-10T13:45:28Z,UCVyhvsEOlug64wperhI9Dpg,Prakash Saput - Topic,10,23.27.04,739552,17829,181,False,False,Provided to YouTube by Amuseio ABSakambari ┬╖ Prakash Saput ┬╖ Barta GandharbhaSakambariтДЧ Prakash SaputReleased on: 2023-04-10Composer: Prakash SaputAuto-generated by YouTube.
_G22RNtu3as,My ShaadiтЭдя╕П,2023-04-18T08:30:14Z,UCfLuT3JwLx8rvHjHfTymekw,Triggered Insaan,22,23.27.04,10605941,979238,52092,False,False,Talking about my marriage.Instagram тЦ║ https://www.instagram.com/triggeredinsaanFacebook тЦ║ https://www.facebook.com/realtriggeredinsaanGaming Channel тЦ║ https://www.youtube.com/liveinsaanDiscord тЦ║ https://discord.gg/liveinsaanTwitter тЦ║ https://twitter.com/triggeredinsaanAbout Me тЦ║ My name is Nischay Malhan. I'm from Delhi and I'm an engineering student. Now I am pursuing youtube Full Time. I make family friendly clean comedy videos on this channel for everyone to enjoy with their family. You don't need earphones to watch my videosЁЯШВThanks For ReadingЁЯШШ
Y4-gFIfGXiQ,Would you go on a Blind Date in Italy?,2023-04-15T20:00:01Z,UCX6OQ3DkcsbYNE6H8uQQuVA,MrBeast,24,23.27.04,96015718,6289354,11714,False,False,
Ltriv7rg_Ro,Girls problems ЁЯШВЁЯШВЁЯШВ #ytshorts #comedy #funny,2023-04-18T14:18:10Z,UCOuPouiVsGZZDsPg-fJPVig,VeerParul Official,23,23.27.04,5440895,264805,657,False,False,
