video_id,title,publish_time,channelId,channel_title,category_id,trending_date,views,likes,comment_count,comments_disabled,ratings_disabled,description
41W_Dx_Ajj4,"Nuno Ribeiro, Calema, Mariza - Maria Joana (Official Music Video)",2023-04-14T11:00:07Z,UCP6u9OBUd4M6U4yzSuv4UNw,Klasszik,10,23.27.04,1814964,38655,1224,False,False,"Music video by @NunoRibeiroOficial, @calema507 and @marizaoficial performing Maria Joana. © 2023 Warner Music Portugal / Klasszik Entertainment. 🇵🇹STREAMING: https://wmpt.lnk.to/mariajoanaCALEMAInstagram: https://bit.ly/3jKUhv9Facebook: https://bit.ly/3boGGa7Spotify: https://spoti.fi/3hU3ctMTiktok: https://bit.ly/3jMwN9aBandsintown: https://bit.ly/40nBPO2FICHA TÉCNICARealização: Nellson Klasszik / Francisco Ramalho  D.O.P. Jihad KahwajConceito: Nellson Klasszik / Grace Macedo Direção de arte: Grace Macedo Assistente de arte: Natália CastañolaFocus Puller: Lucas PalharesAssistente Iluminação: Michel Edição: Nellson Klasszik / Jihad Kahwaji / Francisco Ramalho / Fontourafx / Miguel NorteColorgrading: Jihad Kahwaji / FontourafxDrone: Rui DoresDesigner: Bruno VieiraProdução Executiva : Alexandre Cardoso/Soraia Fernandes/Joana Sousa/Bruna PinheiroProdução: GlitterDiretora de Produção: Thayline Oliveira Assistente de produção: Natalia Castañola / Anna Oliveira / Márcia Pina / Raquel Grilo / Ricardo Lavado Styling: Lizzie FavaroAssistente Styling: Taciana Oliveira Makeup: Eva Pereira/ Margarida Monteiro/ Claudia Pareira Hairstylist: Eric Ribeiro/ Amaná Dabó / Oksana GrybinnykIntérpretes: Nuno Ribeiro, Calema, MarizaLetra:  Nuno Ribeiro, Fradique Mendes Ferreira, Antonio Mendes FerreiraMúsica: Nuno Ribeiro, Fradique Mendes Ferreira, Antonio Mendes Ferreira, Phelipe Ferreira, Nellson KlasszikProdução Nellson Klasszik, RJGravação vozes Nuno Ribeiro e Calema: Nellson KlasszikGravação voz Mariza: Nellson Klasszik, Joao Pedro Ruela, Diogo GuerraGravação instrumentos e vozes tradicionais: KoopperGuitarra: Rodrigo Correia, Bruno Scardini, João Barradas, Manecas Costa, Luís Guerreiro, Phelipe FerreiraConcertina: Filipe GachineiroCavaquinho: Joca AraújoBraguesa: Joca Araújo, KoopperPercussão tradicional: Koopper, Toca Rufar  Coro tradicional: Ana Almeida, Marta Almeida, Paula Almeida, Margarida Afonso, Cármen Mota, Delfina Cerqueira, Cindy Peixoto.Mix: Bruno Gonçalves, Nellson Klasszik, Nuno SerraMaster: Bruno GonçalvesKLASSZIK STUDIOSLETRAE virou!Eu vim do norte direto a LisboaAtrás de um sonho que eu nem sei se voa tanto quanto nós voávamos debaixo dos lencóisA francesinha já não tem picanteE isso faz-me lembrar os instantes em que tu mordias os meus lábios depois do amorNão sei se vou aguentarO tempo que vou cá ficarPorque não estásPorque não estás aquiAs lágrimas vão secar, mas a saudade vai continuarNo meu peito a chamarMaria JoanaMaria JoanaApanha o primeiro autocarroVem ficar pra sempre do meu ladoMinha mãe nunca me viu partirMas todo o filho um dia voaSaudade, saudadeMamã cuida dela por mimDiz-me porque não estás aquiMaria sem ti fico átoaSaudade, saudadeMaria eu quero-te verNão sei se vou aguentarO tempo que vou cá ficarPorque a saudade aperta o meu peito e dói demaisAs lágrimas vão secarMas a saudade vai continuarNo meu peito a chamarMaria JoanaMaria JoanaApanha o primeiro autocarroVem ficar pra sempre do meu ladoMaria, Maria, MariaQuantas lágrimas choreiQuantas noites não dormiCada gota que eu deiteiFez um rio que me leva a tiMaria JoanaMaria JoanaApanha o primeiro autocarroVem ficar pra sempre do meu ladoMaria, Maria, MariaQuantas lágrimas chorei#Portugal #Lusofonia #Cultura"
pZCvOWR3T_I,Cama de Pregos #shorts,2023-04-12T17:08:52Z,UCNrthyyJVjrJUpePrl6lW_g,Neagle,24,23.27.04,9479027,845512,1885,False,False,"● ▸ Baixe agora o NG.CASH - https://bit.ly/NGCASH_NEAGLE    ▪ Carteira Digital pra você ter independencia com sua grana, independente da sua idade! 💸👊🔥 💳 Contato profissional: neagle@fanstar.com.brNossas Redes Sociais:  ▪ Eagle Trindade:📷 https://www.instagram.com/eagletrindade/🐤 https://twitter.com/EagleTrindade🎥 https://www.tiktok.com/@eagletrindade▪ Neox:📷 https://www.instagram.com/gabrielneox/🐤 https://twitter.com/gabrielneox_🎥 https://www.tiktok.com/@gabrielneox_🔥 OUTRO NÍVEL🔥RECOMENDAMOS (INSCREVA-SE)!!!Canal do Flow Key:  http://bit.ly/FlowKeyCanalCanal da Gi:  http://bit.ly/GiCanalCanal do Vini: http://bit.ly/ViniCanalCanal Aquino: http://bit.ly/MateusAquinoCanalCanal da Deka: http://bit.ly/DekaCanalNossa Caixa Postal▪ CEP da Agência: 20550.970▪ Número da caixa postal: 24013"
GGBy50KtvRk,Tipping A Waitress A Car,2023-04-22T20:00:00Z,UCX6OQ3DkcsbYNE6H8uQQuVA,MrBeast,24,23.27.04,31736198,2394370,9664,False,False,New Merch - https://shopmrbeast.com/SUBSCRIBE OR I TAKE YOUR DOG╔═╦╗╔╦╗╔═╦═╦╦╦╦╗╔═╗║╚╣║║║╚╣╚╣╔╣╔╣║╚╣═╣ ╠╗║╚╝║║╠╗║╚╣║║║║║═╣╚═╩══╩═╩═╩═╩╝╚╩═╩═╝----------------------------------------------------------------follow all of these or i will kick you• Facebook - https://www.facebook.com/MrBeast6000/• Twitter - https://twitter.com/MrBeast•  Instagram - https://www.instagram.com/mrbeast•  Im Hiring! - https://www.mrbeastjobs.com/--------------------------------------------------------------------
M3L_zsHjomo,🖤❤️ Respect Jeremie Frimpong 🫶,2023-04-15T15:40:18Z,UCSMZmPVql528Cph9WPvt0GA,Bayer 04 Leverkusen,17,23.27.04,14182873,623615,4242,False,False,What a nice gesture! #shorts #werkself #b04 #bayer04 Become part of the #B04 #Werkself and activate the bell ▶ https://zly.de/ath/B04Bayer 04 Leverkusen on social media:Website ▶ https://www.bayer04.de/Instagram ▶ https://www.instagram.com/bayer04fussball/Facebook ▶ https://www.facebook.com/bayer04fussballTwitter ▶ https://twitter.com/bayer04fussballSnapchat ▶ https://www.snapchat.com/add/bayer04snapsTikTok ▶ http://www.tiktok.com/@bayer04 Soundcloud ▶ https://soundcloud.com/werkself-podcastLinkedIn ▶ https://www.linkedin.com/company/bayer-04-leverkusen/
cimLkAVuuv0,Usei a Roupa Sauna por 1 dia #shorts,2023-04-22T22:32:51Z,UCNrthyyJVjrJUpePrl6lW_g,Neagle,24,23.27.04,2449073,209871,740,False,False,
Bvvw9A3EgG8,7 CURVE CHALLENGE ⚽️,2023-04-18T15:25:00Z,UClk5AUhvoAzN41inRfdLPYw,Celine & Michiel,24,23.27.04,25914500,726198,1517,False,False,:)
mrwj45TsR4E,FINALMENTE ELA CRIOU ONLYF*NS| Numeiro,2023-04-26T18:47:49Z,UCBQmuH679qAvJhsZTIfF-ww,NUMEIRO,24,23.27.04,174871,14421,220,False,False,https://youtube.com/@DeficedeatencaoFor business inquiries: numeiro@gmail.comLink no comentário afixado.
7SfJs2dbF8I,"NOSSA MÃE TEM UM FILHO FAVORITO?? DUELO DE PIADAS COM PIERRE, GEORGE E EU  - CANAL DO CLEPTON",2023-04-19T22:30:01Z,UCDaM5npyBufSF9XF7XnDlsA,CLEPTON,23,23.27.04,4653206,355193,289,False,False,"🎃 Aventuras Estranhas: A Noite Do Meteoro 👻👽 Garanta seu livro https://amzn.to/3aSd1qm#Shorts #HumorSalve, pessoal. Tudo bem vocês?Pra você que está chegando agora, eu sou o Erick Clepton (quase como o cantor), humorista, roteirista, improvisador, namorado da Amanda e irmão do Pierre e do George.Aqui no canal você vai acompanhar curiosidades, entrevistas, piadas, jogos de improvisos e o que mais pudermos inventar! 🚀Participe deixando a sua sugestão de tema e vídeo na aba comunidade, e não esqueça de se inscrever para não perder nenhuma novidade. 🦖Comercial: clepton@flocks.tv🤖Edicão: Gustavo VorageProdução executiva: Clep! Entretenimento Ltda."
Y4-gFIfGXiQ,Would you go on a Blind Date in Italy?,2023-04-15T20:00:01Z,UCX6OQ3DkcsbYNE6H8uQQuVA,MrBeast,24,23.27.04,96015255,6289338,11714,False,False,
9hkq58hMtt4,MESSI OU CRISTIANO RONALDO? MUDANDO OPNIÕES 🤣,2023-04-16T00:30:15Z,UClCtipR9mO5rB2s5mQIjmWw,Jão Bastos,24,23.27.04,6789527,413048,5662,False,False,
arNNTCguJhc,FECHANDO A JANELA DO CARRO EM COISAS ALEATÓRIAS!,2023-04-22T15:00:04Z,UC6paX0kLA8D81aYogceMufw,Rafa & Luiz,24,23.27.04,2212038,183276,862,False,False,
LTLhfStziGQ,Sósia do Neymar Trollando fãs 😂 #shortssprintbrasil #neymar,2023-04-05T22:27:31Z,UC1bfh8MQ4lCWSny0e7xV02g,Ginga Street,17,23.27.04,2857084,160702,480,False,False,
GdaFbJe7NUg,PRIMEIRO MERGULHO NA PISCINA DA CASA NOVA,2023-04-23T11:00:08Z,UC7I9vRncx1-vox41l1A0ACQ,RicFazeres,22,23.27.04,226108,14615,320,False,False,"Miguinhos hoje partilho com vocês o meu maior Projeto de SonhoPartilha da nossa felicidade e rebenta com esse botão do LIKE!!!Acompanha todos os vídeos do meu Projeto Casa de Sonho AQUI 👉 https://youtube.com/playlist?list=PLoH5mUjT5VpWldg0TVTmsT0FITF8KsuHy💎 Torna-te Membro do canal 👉 https://www.youtube.com/channel/UC7I9vRncx1-vox41l1A0ACQ/join••••••••••••••••••••••••••••••••••••••••••••••••••••••••••••••••••••••••••••••••••💼 Contacto Profissional 👉 ricfazeres.contacto@gmail.com (advertising, promos, eventos, presenças, listas escolares,entre outros...)Canal Secundário 👉 FULL GAMEPLAY 👉 https://www.youtube.com/c/FullGameplayySegue-me nas redes sociais 📲💜INSTA   👉 @ricfazeres💙Twitter  👉 @ricfazeres🖤TikTok  👉 @oricfazeres💔Twicth  👉 @RicFazeresOficial💛FACE     👉 RicGaming••••••••••••••••••••••••••••••••••••••••••••••••••••••••••••••••••••••••••••••••••#RICFAZERES #PROJETODEVIDA #ACASADORIC"
4Uy7pDJ6oVE,FIGHT HIGHLIGHTS | Gervonta Tank Davis vs. Ryan Garcia,2023-04-23T05:19:36Z,UCurvRE5fGcdUgCYWgh-BDsg,DAZN Boxing,17,23.27.04,1249436,16498,1648,False,False,"April 22nd, 2023 -- Gervonta Tank Davis vs. Ryan Garcia from Las Vegas.Subscribe to our YouTube channel 👉  http://bit.ly/DAZNBoxingYouTubeSubscribe to the DAZN X Series YouTube channel 👉 https://bit.ly/XSeriesYouTube Download the DAZN app now 👉  http://bit.ly/DAZNYoutubeFollow DAZN Boxing On Social Media 👇Twitter: https://www.twitter.com/DAZNBoxingInstagram: https://www.instagram.com/DAZNBoxingFacebook: https://www.facebook.com/DAZNThe DAZN Boxing Show ► https://bit.ly/3EQ70HNDAZN Rewind ► https://bit.ly/32iAaRT#davisgarcia #DAZN #DAZNBoxing #Boxing"
EAVVuuxAJu0,"Os aplausos, os protestos e a reprimenda. O resumo da sessão solene com Lula da Silva",2023-04-25T13:50:14Z,UC35F6ktZodINwjQZjuwLcjg,Observador,25,23.27.04,460505,8638,4701,False,False,Discurso do Presidente do Brasil foi marcado protestos do Chega — que valeram uma reprimenda de Santos Silva — e pela coincidência da data com a celebração do 25 de Abril.
pokhHxGq9m4,junya jr. Funny Video😂😂😂 |Junya jr. BEST Tiktok!! #shorts #cocomelon #Junyajr.,2023-04-13T08:30:20Z,UCcOcd8YGEHiEb9wWf_N2XZg,Junya jr.andMask / こじゅんや,22,23.27.04,35223825,947524,981,False,False,🙇Please subscribe to the channelhttps://www.youtube.com/channel/UCcOcd8YGEHiEb9wWf_N2XZgtiktok⏩https://vt.tiktok.com/ZSe97yEke/#junya1gou.jr #funny​ ​ #meme​ #memes​ #tiktokcompilation​ #funnyvideo​ #CoffinDance​ #short​ #Shorts #fyp #foryoupage  #funnyshorts #shortsfunny #viral #Viral
JgsWVQpya6E,SHIRT CHALLENGE ⚽️🤔,2023-04-21T15:25:00Z,UClk5AUhvoAzN41inRfdLPYw,Celine & Michiel,24,23.27.04,14109983,602357,448,False,False,:)
oojFZrKuAKg,ESSA CRIANÇA DE 13 ANOS CHUTA MAIS QUE TODO MUNDO!!,2023-04-24T13:03:08Z,UCMPPsRQg12IYk2V7vOfx-9A,Vosso Canal,17,23.27.04,647812,48272,307,False,False,
uA9CHfTbjl8,Esse pai COLOCOU UM GRAVADOR no CABELO de SUA FILHA!,2023-04-12T20:24:52Z,UCONmQOfpk8Y6l2mP6se2egQ,Rodrigo Correa,24,23.27.04,4152387,317856,2616,False,False,
nV8UZJNBY6Y,Adele - The Final Carpool Karaoke,2023-04-24T16:00:26Z,UCJ0uqCI0Vqr2Rrt1HseGirg,The Late Late Show with James Corden,24,23.27.04,12416501,430998,16419,False,False,"It's the last week of The Late Late Show with James Corden and his dear friend @adele surprises him with one final Carpool Karaoke commute to work. Adele takes the wheel and asks James about his memories hosting the show, Carpool Karaoke and the significance of it ending. And the two get emotional reflecting about their friendship and the times they've been there for each other. Watch our Primetime Special this Thursday, April 27th at 10pm followed by our finale episode at 12:37am on CBS and Paramount+Full track list:Rolling in the Deep - AdeleLove Is A Game - AdeleI Drink Wine - AdeleDon't Rain On My Parade - Barbra StreisandHometown Glory - Adele#AdeleCarpool #Adele #CarpoolKaraokeMore Late Late Show:Subscribe: http://bit.ly/CordenYouTubeWatch Full Episodes: http://bit.ly/1ENyPw4Facebook: http://on.fb.me/19PIHLCTwitter: http://bit.ly/1Iv0q6kInstagram: http://bit.ly/latelategramTikTok: http://https://www.tiktok.com/@latelateshowWatch The Late Late Show with James Corden weeknights at 12:35 AM ET/11:35 PM CT on CBS and streaming on Paramount+.---Each week night, THE LATE LATE SHOW with JAMES CORDEN throws the ultimate late night after party with a mix of celebrity guests, edgy musical acts, games and sketches. Corden differentiates his show by offering viewers a peek behind-the-scenes into the green room, bringing all of his guests out at once and lending his musical and acting talents to various sketches. Additionally, bandleader Reggie Watts and the house band provide original, improvised music throughout the show. Since Corden took the reigns as host in March 2015, he has quickly become known for generating buzzworthy viral videos, such as Carpool Karaoke."
6OuAhYQ9xOE,GENIUS FOOD HACKS 🍰 #shorts,2023-04-14T07:55:44Z,UCeYTfGpNCmVhlxjQxBDrGPA,Mr DegrEE,24,23.27.04,81492643,1361304,1842,False,False,So Yummy Chocolate Eraser (school supplies) Cake Decorating Ideas! Thank you for watching. Subscribe to Mr DegreeMusic: https://epidemicsound.com#shortsvideo
h0nnq5vwCgc,Steph casually found a dead spot on the court 😯 | #shorts,2023-04-04T03:03:07Z,UCiWLfSweyRNmLpgEHekhoAg,ESPN,17,23.27.04,32557214,1144845,4996,False,False,Steph Curry casually found a dead spot on the court 😯 #shorts (via @nbcsportsauthentic)✔️ Subscribe to ESPN+ http://espnplus.com/youtube✔️ Get the ESPN App: http://www.espn.com/espn/apps/espn✔️ Subscribe to ESPN on YouTube: http://es.pn/SUBSCRIBEtoYOUTUBE✔️ Subscribe to NBA on ESPN on YouTube: http://bit.ly/SUBSCRIBEtoNBAonESPN✔️ Watch ESPN on YouTube TV: http://es.pn/YouTubeTV#stephcurry #warriors #NBA
4EWC1WTZews,Rabo de Peixe | Trailer Oficial | Netflix Portugal,2023-04-26T09:00:00Z,UCtKMSCXR865x_nFxZfCbw_w,Netflix Portugal,22,23.27.04,281290,817,95,False,False,"Quando uma tonelada de droga chega à praia de Rabo de Peixe, chega também o momento em que o Eduardo e os amigos vão ter de decidir se continuam a ser charrocos num mar de tubarões,ou se mudam o seu destino para sempre. #RabodePeixe a nova série portuguesa estreia a 26 de maio, só na Netflix.Regista-te: https://bit.ly/2uduJ64Sobre a Netflix:A Netflix é um dos principais serviços de streaming que lideram a indústria do entretenimento, a nível mundial. Presente em mais de 190 países, conta com 233 milhões de adesões pagas de membros que usufruem de séries, filmes e jogos de diferentes géneros e em diferentes idiomas. Os membros podem ver, pausar e continuar a ver o que quiserem, quando quiserem, onde quiserem, e mudar de plano em qualquer altura.Segue a Netflix nas redes sociais:➡️TWITTER: https://twitter.com/netflixpt➡️INSTAGRAM: https://www.instagram.com/netflixpt➡️FACEBOOK: https://www.facebook.com/netflixportugalRabo de Peixe | Trailer Oficial | Netflix Portugalhttps://www.youtube.com/@NetflixPortugalOfficialQuando um barco carregado de cocaína se afunda na costa dos Açores, Eduardo vê uma oportunidade para ganhar dinheiro que tem tanto de emocionante como de arriscada."
zm5Ed4AEX_E,Highlights | Resumo: Famalicão 1-2 FC Porto (Taça de Portugal 22/23),2023-04-26T21:44:08Z,UCYqdtLLYQl-Yfs6AwHHuJTA,VSPORTS - Taça de Portugal,22,23.27.04,32312,396,35,False,False,"#VSPORTS #TaçadePortugalO FC Porto venceu por 2-1 o Famalicão no jogo da 1.ª mão da meia-final da Taça de Portugal. Marcano abriu o marcador aos 16 minutos, Penetra empatou aos 36' mas Toni Martínez aos 63' colocou a equipa portista em vantagem na eliminatória. A 2.ª mão joga-se no próximo dia 4 de Maio (2oh30).VSPORTS na Rede: http://bit.ly/YT_vsports_ptVSPORTS no Facebook: https://www.facebook.com/vsports.portugalVSPORTS no Twitter: https://twitter.com/vsports_ptVSPORTS no Instagram: https://www.instagram.com/vsports_pt"
iy9qZR_OGa0,Agust D '해금' Official MV,2023-04-21T03:59:07Z,UC3IZKseVpdzPSBaWxBxundA,HYBE LABELS,10,23.27.04,25215218,3505222,316728,False,False,"Agust D '해금' Official MV'D-DAY' Release📆 4/21 1PM KST | 0AM ET💽 Listen to 'D-DAY': https://ingrv.es/d-dayCredits:  Director: Yong Seok Choi (Lumpens)1st AD: Jihye Yoon (Lumpens)Producer: Ran Ro (Lumpens)Director of Photography: Hyunwoo Nam (MOTHER)B Camera Operator: EumkoFocus Puller: Sungju Min, Youngwoo Lee2nd AC: Youngseo ParkProduction designer: Mu:EArt director: Mu:EAsst. Art Director: Ayeong Choi, Minjung Kim (Mu:E)Art-team Manager: ilho Heo (Mu:E)Production Company: UMOON PRODUCTIONSCo-Producers: Thomas Menard, Julien CasanovaLine Producer: Worarat Buranrom (Charlie)Production Coordinator: Kwanchanok Phukung (Fhan)PA: Chanikarn Nantananate (Punch), Nisha Sukwiwat (Nisha), Chaowat Nittayasut (Pure)Chaperone: Manatchan Sangkhumsut (May), Hatsaya Boonmee (Yeewa), Nichnicha Chumchuwat (Cherish)Set Nurse: Krainaya MethanavakijpaisanFilm Board Manager: Tip SukwiwatThai 1st AD: Kongpob Sangsanga (Marc)Thai 2nd AD: Manassanun Jetsawangsri (Gus)Set PA: Sorakrit WattanamongkolsriLocation Manager: Sittiphorn Kussaravipak (Noom)Location Coordinator: Monrudee Chatsonthi (Mod)Thai 1st AC: Tanawyt Spanyai (Bright), Chatchai Tepun (Song)Thai 2nd AC: Theeraset  Charaemram (View)VDO Man: Thanapong Phuttarakkit (Arm), Phawitsith  Chunngam (Ohm)DIT: Vanika  Suthamkosol (Monn)Movi Pro: Korsak  Prathummarn (Fiat)Gaffer (Gear Head): Surarak Sriumka (Rak)Key Grip: Adisorn Klomsiri (Dang)Remote Head Techincians: Chayanin Kantawanit (Au), Nattawut Phanphoemphul (Wut)Co-Art director(Thai): Sutham Viravandaj (Soviet)Thai Set Decorators: Noppadon Pheamboonsak (Joo), Teeraseth Rienkengsurakarn (Too)Asst. Set Decorators: Somchai Roongkon (Joon), Songkran Jameekornruk (Jub), Peera Udompongwattana (Pee)Admin Art: Jaruwan Jittchaivisut (Pooh)Prop Master: Thanis Archarit (Dome)Asst. Prop Masters: Disakorn Sae-tong (Tong), Wacharapong Teepak (Jeab)Prop Buyers: Akarawat Nudnum (Win), Nitichai Archarit (James)Set Construction: Somchai Soda (Tualek), Nakarin Taithipcharoenchai (Jok)Artist: Pakdee Inchai (Pao)SFX Coordinator: Phuwadon Taweeboon (Pooh)SFX Lead Technician: Ahmad Chalermthai (Maxwell)SFX Floor Technician: Kerati Wongwinyuchon (Best)SFX Senior Technician: Wanchai Cheunchuluk ( Oil )SFX Technicians: Sakchai Cheunchuluk (Kla), Prasit Hemechai (Sith), Todsaporn Chailangka (Arm)Stunt Coordinator: Sumret MuangputStunt Assistant: Sakchai YukhachenUnit Manager: Wannee Ubonwannee (Noona)Unit Assistant #1: Sarawut Ubonwannee (Bank)Unit Runners: Woravut Inthachai (Eak), Nattakan Trongtaweekeat (Mark), Atthawut Kongkham (Aof)Casting Director (Extras): Jay MorinCostume Designer (Extra): Wantana Warintarawech (Joy)Costume Coordinator (Extra): Rujirumpai Mongkol (Por)Stand-By Set: Kotchaphan Deemee (Jeab), Kissana Homtong (Tai)Makeup Artist (Extra): Kunticha  Aiumsumorng (Jeed)Hair Stylist (Extra): Chavalit Surin (Cake)DI: LUCID COLOURColorist: Wonseok KoDI Crew: Jaeyeon Baek, Dain Kim, Seojin Jang, Jihyun Song, Geon KimDI Producer: Ingyeong ChoiBIGHIT MUSIC. Rights are reserved selectively in the video. Unauthorized reproduction is a violation of applicable laws. Manufactured by BIGHIT MUSIC, Seoul, Korea.Connect with BTS:https://ibighit.com/btshttp://twitter.com/BTS_bighithttp://twitter.com/BTS_twthttp://www.facebook.com/bangtan.officialhttps://www.youtube.com/user/BANGTANTVhttp://instagram.com/BTS.bighitofficialhttps://www.tiktok.com/@bts_official_bighithttps://weverse.onelink.me/qt3S/94808190https://www.weibo.com/BTSbighithttps://www.weibo.com/BTSmembershttp://btsblog.ibighit.com#SUGA #AgustD #해금 #Haegeum #슈가 #D_DAY"
ZU0YvOw36RI,EX NAMORADA VISITOU MINHA CASA | NUMEIRO,2023-04-19T17:19:29Z,UCBQmuH679qAvJhsZTIfF-ww,NUMEIRO,24,23.27.04,294263,43329,892,False,False,https://youtube.com/@DeficedeatencaoFor business inquiries: numeiro@gmail.comLink no comentário afixado.
ujzPey9h7Uw,WHEN YOUR DRAWING in Real Life (part 2) #shorts,2023-04-12T12:51:51Z,UCNRl8nOCoUvki2FNFxQZgEg,dednahype,23,23.27.04,54944840,1381320,1475,False,False,#shorts
r9vTMXzTw4w,"Se eu comer sem parar, meu estômago pode explodir? #shorts",2023-04-20T00:00:29Z,UCbAiIkPobUFy71zlmwVw3jw,Fatos Desconhecidos,24,23.27.04,1874489,165894,2145,False,False,"Se eu comer sem parar, meu estômago pode explodir? #shorts"
QpIhhFIMzyo,STOP! ERROU TÁ FORA ❌😱,2023-04-10T20:28:10Z,UC0B-TS2aNtXcaaX8k3qVYXw,Gu Reis,20,23.27.04,1178098,88642,300,False,False,
1Z9-pltVxtI,Quando o nerd é goleiro,2023-04-16T14:00:02Z,UCxnsgtkUiHxeHM2z2mMlGiA,Goleiro De Capacete,17,23.27.04,3789910,258662,295,False,False,Feat Dudu footz
2d2R5MPqG4w,Guy Smashes Car's Window to Rescue Dog,2023-04-04T12:00:03Z,UCYZKDmmS5NNIaiD6hlNWh7Q,DailyPicksandFlicks,24,23.27.04,30218619,444707,21371,False,False,"Subscribe For More Videos: http://bit.ly/DailyPicksAndFlicksYTLike Us On Facebook: https://bit.ly/2TL5eSLFollow Us On Twitter: https://bit.ly/3jPKtzGHave a video you want us to see? Submit it here: https://bit.ly/3jRbqDlHi and welcome to Daily Picks and Flicks – viral videos, funny pictures and odd news blog. We cover all the funny, interesting and strange stuff that is buzzing around the world. The weirder the better. Each day, we surf the web in an effort to find interesting, entertaining and unique videos, pictures and weird news stories. If you like what you find here, please recommend us to your friends. We already like you.All the videos on this channel have been properly acquired from their rightful owners. For licensing / permission to use: Contact - licensing(at)jukinmedia(dot)com"
bOSfb8PaLR8,O DONO DA BOLA 😂,2023-04-07T22:33:10Z,UC1bfh8MQ4lCWSny0e7xV02g,Ginga Street,17,23.27.04,3201455,0,84,False,True,
z0JPglu3I0c,Juicy Red Raspberry Nail that turns Poisonous White in Water 🍓☠️💦 #nails #art #cute #nailtutorial,2023-04-21T02:19:56Z,UCkWOpf05w9dPthQ-2tXndfA,ilysm Nails,26,23.27.04,12047085,327422,997,False,False,
pSNjnAtrP2E,KAPPA JOTTA - COISAS NA CABEÇA (Video Oficial),2023-04-18T17:00:12Z,UCcVW0Qs3ECMDUl35GYcXz1A,KAPPA JOTTA,10,23.27.04,173961,5015,203,False,False,"Ouve e descarrega aqui: https://KappaJottaCoisasNaCabeca.lnk.to/LSj65ww6PRhttps://KappaJottaCoisasNaCabeca.lnk.to/LSj65ww6PRSpotify: https://open.spotify.com/album/5a82H0UW4hecXTZWD713Aq?si=vxwo_jOoQzGtbcMOfYwViA si=HHlP3NGaTu6BtF9Nm4soDQFollow Kappa Jotta:https://www.instagram.com/kappa_jotta/https://www.tiktok.com/@kappa_jotta https://twitter.com/kappa_jottahttps://www.facebook.com/kappajotta27________________________Creditos:Escrito e interpretado: Kappa JottaGuitarras: GemiinyProduzido: Kappa JottaMix e master: Cunha BeatsVideo:Directed By: Mike AkFotografia: BernvsAgradecimento especial às Comunidades da Ulmeira, Serra da Luz e Fim do Mundo._______________________________________© & Ⓟ -  2023 - Good Fellas Good Music_______________________________________CONTACTO: goodfellasgoodmusic@gmail.com"
biPKMNpY-bc,СЕРДЕЧКУ БОЛЬНО СТАЛО...НЕ ПОСТУПАЙТЕ ТАК😪🐶💔,2023-03-31T10:18:48Z,UCXmseTCR4w5q36pupOJKegw,Chapitosiki,24,23.27.04,80893354,1883318,21175,False,False,"Всем привет, вы на канале Chapitosiki! Чапи и Тося очень дружные, даже если у одной из милых таксиков упало настроение, вторая обязательно ей поднимет его, и хозяевам поднимет. Но кто поднимет настроение поднимателю? Сердечку больно стало, как поступили с собачкой - не поступайте так! Новые видео про милых собачек Чапитосиков. Что же произошло в этот раз - скорее смотрите!ЗАКАЗЫВАЙ ИГРУШКУ ЧАПИТОСИКИ НА ОФИЦИАЛЬНОМ САЙТЕ: https://chapitosiki.com/ИГРАЙ В ЧАПИТОСИКОВ 👉🏻 PLAY CHAPITOSIKI GAME: http://pimpochka.games/chapitosikiСЛУШАЙ ТРЕК ТЫ НА РЕПИТЕ: https://zvonko.link/14777DA🐶ЧАПИТОСКИН ВКОНТАКТЕ: https://vk.com/chapitosinka🐶ЧАПИТОСКИН TIK TOK https://vm.tiktok.com/ZSJ7saYCy/ 🐶ЧАПИТОСКИН TELEGRAM: https://t.me/chapi_tosya🐶ЧАПИТОСКИН RUTUBE: https://rutube.ru/channel/24282446/🐶ЧАПИТОСКИН OZON моменты: https://ozon.ru/user/chapi_tosya?from=share_iosСотрудничество и реклама: chapitosiki@wildjam.ru#чапитося #dog #shorts #собаки"
CFgfVmvHU24,Ficou Sem 🧨,2023-04-10T14:07:00Z,UC371icpvZj2oQaocL0i9L-g,DUDU e CAROL,24,23.27.04,5026962,157497,204,False,False,"A Carol queria só uma e o Dudu pegou todas, mas ela virou Hahah e ele ficou sem#DUDUeCAROL #shorts"
PX7mkx5sWiI,Fatos muito ESTRANHOS,2023-04-18T21:00:10Z,UCjccbzNlczaBBwZwVjBXHiA,sabfulero1,20,23.27.04,3110308,257607,3013,False,False,🤨SERVIDOR DO DISCORD- https://discord.gg/Zgec5FXvHQtiktok- @sabfulero2insta- @saborilastwitter- @saborilas#shorts #minecraft
