video_id,title,publish_time,channelId,channel_title,category_id,trending_date,views,likes,comment_count,comments_disabled,ratings_disabled,description
pov0FfWgZ9o,Prakash Saput New Song Sakambari [ Phoolmaya ] Sunil Thapa | Kusum Sharma | Official MV 2023,2023-04-13T09:00:08Z,UCLjMHtCwaTy4aCs-EVudqYQ,Prakash Saput,10,23.27.04,17572769,489530,22612,False,False,"In the lyrics of Sakambari song, it is shown how a common man goes on the wrong path due to his compulsion and ambition, while through the video, Sexual Harassment in different areas is presented symbolically.Prakash Saput Presents:- New Nepali Song 2023|| Sakambari рд╕рдХрдореНрдмрд░реА ||#prakashsaput #sunilthapa #kusumsharma#newnepalisong #nikssharma#sudipsagar-----------------------------------------Official TikTok:- https://vt.tiktok.com/ZS8noNcX1/Spotify:- https://spoti.fi/3msgV2BiTunes:- https://apple.co/3oeB8sYЁЯО╢ Audio Credits:- тЩм Vocal:- Prakash SaputBarta GandharbhaтЩм Lyrics | Music:- Prakash Saput@PrakashSaput тЩм Music Arranger:- Sudip SagarтЩм Audio Mixing:- Shyamshwet RasailyPrisma StudioтЩм Background Score:- Sudip Sagar Kiran BKтЩм Flute:- Ratna BK@RatnaBKUtsukratnabk тЩм Sarangi:- Hemanta Kanchha Rasaily@HemantaKanchhaRasaily тЩм Guitar | Benjo:- Sanjeev Baraili@sanjeevbaraili2239 тЩм Dholak | Tabala:- Bhuwan GandharbhaтЩм Madal:- Poshan Gharti MagarтЩм Recordist:- Kamal Thapa Govinda Anek-----------------------------------------ЁЯОмя╕П Video Credits:- ЁЯОмя╕П Story | Direction:- Prakash SaputЁЯОмя╕П Co-Direction:-Sunil BK@BrothersBondOfficial ЁЯОмя╕П Creative & Casting Direction:- Bishal GhimireЁЯОмя╕П Choreographer:- Bibek KhadkaЁЯОмя╕П Cast:- Sunil ThapaKusum SharmaNiks SharmaSanjog RasailySaraswati AdhikariSarita RajopadhyayaSalik Bhandari& OthersЁЯОмя╕П Cinematographer:- Nabaraj Uprety(Maan Creation)ЁЯОмя╕П Edit:- Prabin BhattaBP Films NepalЁЯОмя╕П Color | VFX:- Milan BishwokarmaЁЯОмя╕П Photography:- Janak DevkotaЁЯОмя╕П Publicity Design:- Gajendra ChaliseCreative IdeasЁЯОмя╕П Graphics & Title Animation:- Uttam Kumar KarkiSumeesha Creation@sumeeshacreation7381 ЁЯОмя╕П Title Typography Design:- Pawan Simkhada @pyaropawan ЁЯОмя╕П Content Mangement and Digital Distibution:- Rajendra Aryal @RajendraAryal ЁЯОмя╕П Production Manager:- Milan KatwalЁЯОмя╕П Set Design:- Jata Shankar GosaiЁЯОмя╕П Make Up Artists:- Bimala TamangSuman LamaЁЯОмя╕П Fashion Designer:- Anisha WaibaЁЯОмя╕П Camera Assistants:- Rajib ChhetriIshwor RijalRitesh Thapa ЁЯОмя╕П Focus Puller:- Laxman UpretyЁЯОмя╕П Light & Technical Management Team:- Sundar BaskotaLaxman KharelPrakash KharelЁЯОмя╕П Spot Boy:- DipakSamirЁЯОмя╕П Equipment:- Chhaya CreationЁЯОмя╕П Transportation:- Kumar GurungЁЯОмя╕П Kitchen:- Harka LamaЁЯОмя╕П Special Thanks:- Everest Hospital, BaneshworGlow Beauty Studio, Kathmandu MallBlack & Gray Tatoo Studio, Kathmandu MallShrey Courtyard, AloknagarHotel Sabrina, GolfutarЁЯОмя╕П Thanks:- Dil Siris (kathalika.com) Lyrics:- рдХрд╛рдирдорд╛ рдЭреБрдореНрдХрд╛рдирд╛ рддрд┐рдореНрд▓рд╛рдИ рдХрд▓реНрд▓реЗ рдХрд┐рдиреНрджрд┐рдпреЛ рдирд╛рдХрдХреЛ рдмреБрд▓рд╛рдХреА рддрд┐рдореНрд▓рд╛рдИ рдХрд▓реНрд▓реЗ рдХрд┐рдиреНрджрд┐рдпреЛ..рдкрд╛рдЙрдорд╛ рд▓рд╛рдХреЛ рдкрд╛рдЙрдЬреБ, рд╣рд╛рддрдорд╛ рд╕реБрдирдХреЛ рдЪреБрд░рд╛ рддрд┐рдореНрд▓рд╛рдИ рдХрд▓реНрд▓рд▓реЗ рдХрд┐рдиреНрджрд┐рдпреЛтАж рдлреБрд▓рдорд╛рдпрд╛ ремрдЬрд╛рдЧреНрдпреЛ рд░рд╣рд░ рдкрд╛рдкреА рд╢рд╣рд░рдХреЛ рдЫреИрди рд╕рд┐рдорд╛рдирд╛ рдЖрдлреНрдиреИ рд░рд╣рд░рдХреЛрд▓реМ рдзрд░реНрдореИ рдорд╛рд╕реНрдиреЗ рдЬрд╣рд░рд▓реМ рд░рдЩреНрдЧреАрди рд░рдЩреНрдЧреАрди рд░рд╣рд░ рддрд┐рдореНрд▓рд╛рдИ рдХрд▓реНрд▓реЗ рдХрд┐рдиреНрджрд┐рдпреЛ.. рдлреБрд▓рдорд╛рдпрд╛..рдЬреЛрд╡рди рд╕рд╛рдЯреЗрдЙрдХреА рдзрдирдХреЛ рдЖрд╕реИрд▓реЗ рдмрд╣рдХрд╛рдпреЛрдХрд┐ рддрд┐рдореНрд▓рд╛рдИ рдХрд╕реИрд▓реЗрд╣реЗрд░ рд╣рд┐рдбреНрдЫреЗрдЙ рдкрд░ рдкрд░. рд╣реЗрд░ рд░рд╛рддреИ рд╕реНрдХреБрдЯрд░тАжрддрд┐рдореНрд▓рд╛рдИ рдХрд▓реНрд▓реЗ рдХрд┐рдиреНрджрд┐рдпреЛ.. рдлреБрд▓рдорд╛рдпрд╛рдзреБрд╡рд╛рдБ рд╕рд░реА рдорди рдЙрдбрд╝рди рджрд┐рдпреМрд░рдлреБрд▓реИ рд╕рд░реА рддрди рдЪреБрдБрдбрди рджрд┐рдпреМрд░тАжрдпрд╕реНрддреЛ рдЖрдБрдЦрд╛ рдЦрд╛рдиреЗ  рдбрд╛рдИрдордгреНрдбрдпрд╕реНрддреЛ рдИрдорд╛рди рдЦрд╛рдиреЗ  рдШрдордгреНрдб рддрд┐рдореНрд▓рд╛рдИ рдХрд▓реНрд▓реЗ рдХрд┐рдиреНрджрд┐рдпреЛ.. рдлреБрд▓рдорд╛рдпрд╛рдШрд╛рдЯреА рдирд┐рд░реИ рдбрд╛рдо рдХреЗ рдХреЛ рд╣реЛрд▓рд╛рдиреА рд░рд╛рддреА рддрд┐рд░реИ рдХрд╛рдо рдХреЗ рдХреЛ рд╣реЛрд▓рд╛рдиреАрдУрд╣реЛ рдореБрд▓реНрдп рдмрдвреА рдмрдвреА, рдУрд╣реЛ рдореЛрдмрд╛рдИрд▓ рдЯрд┐рднреА рдШрдбреАрддрд┐рдореНрд▓рд╛рдИ рдХрд▓реНрд▓реЗ рдХрд┐рдиреНрджрд┐рдпреЛ.. рдлреБрд▓рдорд╛рдпрд╛рд░рд╕ рдЧрд╛рд▓реИрдХреЛ рд╕реБрдХреА рдЬрд╛рдиреЗрдЫрдЖрдлреНрдиреИ рдЖрддреНрдорд╛рд▓реЗ рдереБрдХреА рдЬрд╛рдиреЗрдЫрдпреЛ рд╡реИрд╢ рд╕рдзреИ рдлрд▓реНрдЫ, рдпреЛ рдЬрд┐рд╡рди рдпрд╕реИ рдЪрд▓реНрдЫ рддрд┐рдореНрд▓рд╛рдИ рдХрд▓реНрд▓реЗ рднрдиреНрджрд┐рдпреЛ.. рдлреБрд▓рдорд╛рдпрд╛ Lyrics In English:- Kanma Jhumkana Timlai Kalle KindiyoNakko Bulaki Timlai Kalle KindiyoPauma Lako Pauju, Hatma Sunko ChuraTimlai Kalle Kindiyo, PhoolmayaJagyo Rahar Papi ShaharkoChhaina Simana Aafnai RaharkoLau Dharmai Masne JaharLau Rangin Rangin RaharTimlai Kalle Kindiyo, PhoolmayaJoban Sateuki Dhanko AashaileBahakayoki Timlai KasaileHera Hidchheu Para ParaHera Ratai ScooterTimlai Kalle Kindiyo, PhoolmayaDhuwa Sari Man Udna DiyauraPhoolai Sari Tan Chudna DiyauraYesto Aankha Khane DiamondYesto Iman Khane GhamandTimlai Kalle Kindiyo, PhoolmayaGhati Nirai Dam Ke Ko HolaniRati Tirai Kaam Ke Ko HolaniOho Mulya Badhi BadhiOho Mobile TV GhadiTimlai Kalle Kindiyo, PhoolmayaRasa Galaiko Suki JanechhaAafnai Aatmale Thuki JanechhaYo Baisha Sadhai PhalchhaYo Jiban Yesai ChalchhaTimlai Kalle Bhandiyo, Phoolmaya----------------------------------------Stream my songs on:- iTunes:- https://apple.co/3KBHl8tAmazon:- https://amzn.to/3KCG5BQSpotify:- https://spoti.fi/35UJ2PsApple Music:- https://apple.co/3pZvlWpTidal:- https://bit.ly/3I7C2fcAmazon Music:- https://amzn.to/3pTNZifSoundcloud:- https://bit.ly/3tPsNLDYouTube Music:- https://bit.ly/3CBSd3jDeezer:- https://bit.ly/3CE9E3sQobuz:- https://bit.ly/3HY5mVuNapster:- https://bit.ly/3hY31PFSocial Links:- Facebook:- https://goo.gl/QubDZCWeb:- https://goo.gl/6BdrgDTwitter:- https://goo.gl/1t8S62Instagram:- https://goo.gl/Tjii86Subscribe to me:- https://goo.gl/RbyyaS┬й & тДЧ Prakash Saput, All Rights Reserved."
bhvXFiesEgo,рджреЛрд╕реНрддреАЁЯе╣ #ytshorts #youtube #shorts,2023-04-09T08:16:19Z,UClNJdbiH8_p21eQ9DuR0esQ,Prashant Yadav Shorts,22,23.27.04,25390610,1802420,71729,False,False,
8ad6nES3WYk,NEPAL VS OMAN || ACC MEN'S PREMIER CUP || MATCH 7 || Road To Asia Cup,2023-04-21T11:36:22Z,UCreBLWjg751-BcFQFtNPPtA,OSR Sports,17,23.27.04,1063633,19187,111,False,False,"OSR Sports is authorized to upload this video. Using of this video on other channels without prior permission will be strictly prohibited. (Embedding to the websites is allowed)рдпрд╕ рдЪреНрдпрд╛рдирд▓ рдорд╛ рд░рд╣реЗрдХрд╛  Video рд╣рд░реБ рдХрдкрд┐, Download рдЧрд░реА рдЕрдиреНрдп Channel рдорд╛ upload рдЧрд░реЗрдХреЛ рдкрд╛рдПрдорд╛ рдкреНрд░рдЪрд╛рд▓рд┐рдд рдХрд╛рдиреБрди рдмрдореЛрдЬрд┐рдо рдХрдбрд╛ рднрдиреНрджрд╛ рдХрдбрд╛ рдХрд╛рд░рдмрд╛рд╣реА рдЧрд░рд┐рдиреЗрдЫ ред рд░ рд╕реЛ Channel рд▓рд╛рдИ рдмрдиреНрдж рдЧрд░рд┐рджрд┐рдиреЗ рдЫреМ ред"
E2GM1OusdTI,The Kapil Sharma Show S2 | Salman Bhai рд╣реИрдВ рдХрд┐рд╕ рдХрд┐рд╕рдХреА рдЬрд╛рди? | Pooja Hegde | Ep 319 | 16 Apr 2023,2023-04-23T17:30:01Z,UCpEhnqL0y41EpW2TvWAHD7Q,SET India,24,23.27.04,2143725,37118,1323,False,False,"Synopsis: Salman Bhai рд╣реИрдВ рдХрд┐рд╕ рдХрд┐рд╕рдХреА рдЬрд╛рди? ----------------------------------------------------------------------------------------------------- Salman Khan along with his co-actor Pooja Hegde makes a royal entry on the sets in between the full shouting of the audience. Kapil praises Salman's new film 'Kisi Ke Bhai Kisi Ki Jaan' and his role in Pathan. He also mentions the huge fan following of Salman Khan. Then they had a fun-filled conversation about the ice cream candies. How will Kapil entertain them, Watch the episode and know more!!Show Name: The Kapil Sharma Show Season 2Guest Names: Salman Khan, Pooja Hegde, Raghav JuyalHost: Kapil Sharma, Archana Puran SinghEpisode: 319 - 16 Apr 2023Producers: Kapil Sharma#thekapilsharmashow #kisikabhaikisikijaan #salmankhan #poojahegde #raghavjuyal #setindia #рджреАрдХрдкрд┐рд▓рд╢рд░реНрдорд╛рд╢реЛ  #comedy #archanapuransingh Click here to Subscribe to SET India: https://www.youtube.com/channel/UCpEhnqL0y41EpW2TvWAHD7Q?sub_confirmation=1Click here to Subscribe to SonyLIV: http://www.sonyliv.com/signinAbout The Kapil Sharma Show Season 2: ----------------------------------------------------------------Kapil Sharma is back with his gang - Bindu, Chandan, and 'mohalle ki dhoban' Gudiya. In tow is a new character, Maski, along with Goli, Roopmati, and more! Enjoy guaranteed laughter with Kapil and his antics as different celebrities join in.Click here to watch the full episode of The Kapil Sharma Show: https://www.sonyliv.com/dplnk?schema=sony://asset/1000216816 The Kapil Sharma Show S2 | Salman Bhai рд╣реИрдВ рдХрд┐рд╕ рдХрд┐рд╕рдХреА рдЬрд╛рди? | Pooja Hegde | Ep 319 | 16 Apr 2023"
Q4atSvuD8rA,School Nahi janeka ka BahanaЁЯШВтЭдя╕П |End tak dekhna zaroor|ЁЯШВ #shorts #funny #comedy #schoollife,2023-04-15T14:50:11Z,UCSNpkW6wDg-0Gf7nxk0aFBQ,Deepali Markam,22,23.27.04,38531800,1528508,12980,False,False,
C3rmFA23NOg,End tak zarur dekhnaЁЯШВЁЯдг #trending #comedy #funny #viral #shorts,2023-04-21T14:40:51Z,UCIhJOWBJywuJKeF61CWCrMw,Noman Official,1,23.27.04,13054789,643005,1429,False,False,
1gxlLH6SEew,Papa ne bnayi beti ko gudiya  | Magical father | Sonam Prajapati,2023-04-22T15:00:01Z,UCsBbEuwX_rf2I3l2ucGABjw,Sonam Prajapati,22,23.27.04,12460591,281279,183,False,False,"Business Inquiry: sonam.official50@gmail.com______________________________________My Others Channel:*https://www.youtube.com/channel/UCKXibLTQ_ijPoFyWxf2juGA?view_as=subscriber*https://www.youtube.com/achannel/UCND5ppDpEt5pVqX-bHGpcjA/videos*https://www.youtube.com/c/SonamPrajapatiтЦ║тЦ║Sister Channelhttps://www.youtube.com/channel/UCAQlKCfUMsMbxFZ7iK86_nA/videoshttps://www.youtube.com/channel/UCboFoXfar6344PLyTtHvf4A/videos______________________________________My social LinksтЦ║тЦ║instagram   https://www.instagram.com/thesonamprajapati/тЦ║тЦ║Facebook fan page   https://www.facebook.com/TheSonamPrajapati/______________________________________AUDIO DISCLAIMER/CREDITS тАУ Music from Epidemic Sound (http://www.epidemicsound.com)DISCLAIMER: The information provided on this channel and its videos is for general purposes only, does not intend to hurt anyone's sentiment, religion, etc., and should not be considered as professional advice as these videos are for Fun."
maIVdSDCs9s,Momo vs Spring roll ЁЯе╡ЁЯе╡ #shorts #trending #trendingshorts #viral #foodlover,2023-04-19T08:48:41Z,UCXgv6qemwooHi71a7-htxAw,Sandeep Bhatt Vlogs,22,23.27.04,10713627,612957,280,False,False,
-C5SxShKWus,meri maa ke barabar koi nahi тЭдя╕П #short #emotional #motivational #maa#trending#vairl,2023-04-21T08:53:52Z,UCjwVFhVWWpJ_GujZpa_d5bA,Sarlahi Music,10,23.27.04,25660370,376036,763,False,False,
d9eTTsaFZ4s,Finally I Caught Ice Cream Thief - Pinchu  #gadgets #shorts,2023-04-17T09:52:24Z,UCBbeXVY55K5estTHrKWJ5Yg,Tech FC Shorts,28,23.27.04,17593734,993515,767,False,False,"Finally, i caught ice cream thief - Pinchu #gadgets #shorts #securitycamera"
GOvnKcOKvPg,Naagin ne liya police ka roop ЁЯРН #vijaykumarviner #emotional #motivation #humanity #naagin,2023-04-22T02:54:44Z,UCfIpFdLEnTfkXjcwsiO4dAA,Vijay Kumar Viner Vlogs,24,23.27.04,9847741,417965,103,False,False,
SndZw9KOlZ4,Aapke sath hua hai kabhi aisa?ЁЯШВтЭдя╕П #shorts #bairanmatke #sapnachoudhary #newharyanvi #funny #comedy,2023-04-21T14:08:21Z,UCSNpkW6wDg-0Gf7nxk0aFBQ,Deepali Markam,22,23.27.04,12489909,0,375,False,True,
PjX4fx81aV8,How I Made Her Phone And Money Disappear #shorts,2023-04-17T16:02:34Z,UC3xgevNpGmAgWpdjtTXR20w,Wian,24,23.27.04,35652615,1363704,1668,False,False,
dOZRnp7Pm5Q,Mummy ki chappal ЁЯШВ | Shruti Shorts,2023-04-08T12:00:34Z,UCsSC6inBVGt5Gj-nCVBEx-A,Shruti Shorts,23,23.27.04,6988943,133484,137,False,False,Disclaimer: This video is the intellectual property of Shruti Shorts which is owned & managed by SpiceUp Media.Website: https://spiceupmedia.com#shrutiarjunanand #shrutishorts #mummy #momanddaughter #mummykichappal #shorts #mummyandpapa #trending #trendingshorts #shruti #trend #richvspoor #thenvsnow #richvsnormal #desivsmodern #thegirls #theboystrend #typesofpeople #school #schoollife #funnyshorts #funny #diyqueen #anaysa #anaysashorts #toystars #bhaibehenkapyar #shortvideo #youtubeshorts #strong #typesofphone #comedy #comedyshorts #funnyshorts #ytshorts #momandgaughtercomedy #comedyshorts #cutebaby #cutedaughters
KCBWbgthmMU,рджреБрд░реНрдЧрдордХреА рдбрд╛рдХреНрдЯрд░рдХреЛ рдХрдерд╛ | Durgamki Doctor ko Katha | Herne Katha EP104 | рд╣реЗрд░реНрдиреЗ рдХрдерд╛,2023-04-22T13:15:10Z,UCZuKpNyipL9W-OkKwCMwVNQ,Herne Katha,1,23.27.04,460187,22397,2132,False,False,"рдЖрдБрдЦрд╛рднрд░рд┐ рдмрд╕реНрдиреЗ рдирд┐рд▓рд╛ рдЖрдХрд╛рд╢, рдХрд╛рд╡рд╛ рдЦрд╛рдЗрд░рд╣реЗрдХрд╛ рдЪрд░рд╛рд╣рд░реБ, рд╕рдЩреНрд▓рд╛ рдирджреАрд╣рд░реБ,  рд╣рд┐рдЙрдБрд▓реЗ рдЫрдкрдХреНрдХреИ рдврд╛рдХреЗрдХрд╛ рдмреБрдХреАрд╣рд░реБ ред рдЖрд╣рд╛ рджреБрд░реНрдЧрдо рдд рдХрд╕реНрддреЛ рд╕реБрдиреНрджрд░ ред рдпреА рдореБрд╕реНрдХреБрд░рд╛рдЗрд░рд╣реЗрдХрд╛ рд╣рд┐рдорд╛рд▓рдордиреНрддрд┐рд░ рдЬрдм рддреБрд▓реНрд╕реАрд▓реЗ рдЬрд┐рдЩреНрдЧреНрд░рд┐рдЩреНрдЧ рдкрд░реЗрдХрд╛ рд░реЛрдЧреА рдЧрд╛рдЙрдБрд╣рд░реБ рджреЗрдЦрд┐рдиреН, рдЙрдирд▓реЗ рдордирдорд╛ рдЦреЛрдкрд┐рдПрдХрд╛ рдЕрдХреНрд╖рд░ рдкрдврд┐рдиреН -  рдЙрдирдХреЛ рдХрд╛рдо рд╕рдиреНрдЪреЛ рдкрд╛рд░реНрдиреЗ рд╣реЛ ред #DurgamkiDoctor #hernekatha It takes two days of walking to reach the Pulu village of Karmarong; a remote village situated under the shadow of the lonely mountains in Mugu. Tulasi Shahi walked up these lonely mountains years ago, with a single purpose - to heal. тЭдя╕П A warm and gentle request тЭдя╕ПHerne Katha is amazingly proudly independent journalism. We are free from political or corporate influence. If you love our work and believe in our absolute, astonishing and proud independent journalism please consider supporting us (please only support us if you are financially comfortable). Herne Katha will be free forever, no matter what.Become our Patreon: https://bit.ly/2BrQzlQ Become a YouTube Member: http://bit.ly/JoinHerneKathaЁЯЪАЁЯЪАЁЯЪА Herne  Katha Team ЁЯЪАЁЯЪАЁЯЪАЁЯОм Script/Direction - Kamal Kumar (http://bit.ly/KamalKumarFB)ЁЯСй Presenter - Bidhya Chapagain (http://bit.ly/BidhyaTwitter)ЁЯОе Cinematographer - Jeevan Rijal (http://bit.ly/JeevanRFB)ЁЯЦе Video Editor - Sandesh Pariyar (http://bit.ly/sandeshpfb)ЁЯУЭ Curator in Charge - Anusha Khanal ЁЯСНЁЯСНЁЯСН Follow Herne Katha ЁЯСНЁЯСНЁЯСНЁЯСЙ IMDB: https://www.imdb.com/title/tt8103440/ЁЯСЙ Facebook:  https://facebook.com/hernekathaЁЯСЙ Twitter: https://twitter.com/hernekathaЁЯСЙ Instagram: https://instagram.com/hernekathaЁЯСЙ Website: https://hernekatha.comЁЯСЙ TikTok: https://www.tiktok.com/@hernekatha==== Why Herne Katha? ====People behind Herne Katha spent 15 years of their lives doing journalism. One day they realised the need to tell more beautiful and inspiring stories of people, the real people. ЁЯСАЁЯСАЁЯСА Herne Katha ЁЯСАЁЯСАЁЯСАHerne Katha is a web series produced by Tana Bana Digital in Nepal. We tell stories of people in the format of short documentaries. New episode of Herne Katha is published on  every  alternate Tuesdays (15 days) on YouTube. You can also watch Herne  Katha on Kantipur  Television every Tuesday 6:30 PM.ЁЯТМЁЯТМЁЯТМ Share your Story ЁЯТМЁЯТМЁЯТМ If you have a story that is suitable for Herne Katha, please do not hesitate to contact us. ЁЯТ▓ЁЯТ▓ЁЯТ▓ For Advertisers ЁЯТ▓ЁЯТ▓ЁЯТ▓ If you are an advertiser interested in our show please write us an email  hello@hernekatha.comЁЯО╢ЁЯО╢ЁЯО╢ For Singers and Musicians ЁЯО╢ЁЯО╢ЁЯО╢ If you are an emerging artist or musicians, we need you. We want to feature your creation in our episodes and support you to get noticed by thousands of our audience. ЁЯОиЁЯОиЁЯОи For all Creatives ЁЯОиЁЯОиЁЯОиHave an idea about anything? Anything related to telling people's stories in bold and beautiful style. Share your ideas with us. We love ideas.  ЁЯШвЁЯШвЁЯШв Sorry ЁЯШвЁЯШвЁЯШв We put a lot of effort to create a single episode of Herne Katha. We will be heartbroken if somebody copies and re-uploads our videos. However, we feel good if you share our links or embed our videos on your blog/website.ЁЯФ┤ You have come this far reading all the description. Now you deserve to subscribe our channel ЁЯША"
LnoUUtWvjhI,nepali prank || shoe maker/рдЬреБрддреНрддрд╛ рд╕рд┐рд▓рд╛рдЙрдиреЗ/part -2 | funny /comedy prank | alish rai new prank 2023 |,2023-04-23T12:15:10Z,UC3eTHGL1KiDJcNgOKQjLE_w,Alish Rai,24,23.27.04,339557,22603,1476,False,False,"#alishrai #nepaliprank #shoesprankGO AND WINWebsite Link: https://bit.ly/3tFat8C Get your 130% deposit bonus up to 12 000 NPR by promo code: ┬лRAI22┬╗ЁЯФ┤SUBSCRIBE MY CHANNEL..   / channel  ЁЯФ┤16 duna 8 channelhttps://www.youtube.com/results?searc... special thanks,/ camera ;,Prakash Nepal,raj rokayaLike,Comment and Share this video Follow me on -ЁЯФ┤FB. PAGE:https://www.facebook.com/profile.php?...ЁЯФ┤ instagram.https://www.instagram.com/alishrai_of...DONt forget to like share and comment,,,,,,,,, And next video will be back soon,,,,DONT FORGET TO SUBSCRIBE MY CHANNELmore details , alishrai2074@gmail.com"
D_kaowgb2gQ,Office thali #lunch #shorts #lunchthali,2023-04-22T12:35:19Z,UCVTMP2Fx3OPSGDiASWrDg4g,Shobha Pandey Vlogs,22,23.27.04,14730285,350981,741,False,False,
