video_id,title,publish_time,channelId,channel_title,category_id,trending_date,views,likes,comment_count,comments_disabled,ratings_disabled,description
jI9sL6FT9P4,Quando eu derrubo o celular na chuva,2023-04-14T14:03:48Z,UCWNtk_dUMvg3IVu4fsXRmhQ,O Netinho,22,23.27.04,4270548,179042,194,False,False,Se inscrevam no canal principal @Maneirando #shorts
WF6KYaPrxT0,Mc Daniel x Nog - * da Anitta (Prod. Paiva) - Lyons Produções,2023-04-12T21:15:10Z,UCwnSOhrpJLe-bwARGDMQEVA,Lyons Produções,10,23.27.04,6835948,262541,62944,False,False,"Mc Daniel & Nog (Costa Gold) - * da Anitta (prod.Paiva)Ouça na plataformas digitais: https://onerpm.link/*daanittaMc Daniel:  https://www.instagram.com/mcdanieloficiall/Nog: https://www.instagram.com/nogcaio/Produção MusicalPaiva Prod: https://www.instagram.com/paiva.prod/ComposiçãoNog: https://www.instagram.com/nogcaio/André Drum: https://www.instagram.com/drum_sp/Mc Daniel: https://www.instagram.com/mcdanieloficiall/Mixagem / Masterização:André Nine: https://www.instagram.com/andrenine_/Brendan Duffey: https://www.instagram.com/brendan_duffey_audio/Produção Geral: Régis Ramos: https://www.instagram.com/doisr_/Produção Executiva:André Drum: https://www.instagram.com/drum_sp/Marcio BontempoVini SerafimDireção: Mateus RigolaProdução: Luan Raphael Edição: Mateus RigolaRoteiro: André DrumAssistente de câmera: Gabriel Kohari e Thiago RosaAssistente de produção: Pamela PrietoAjudantes: Gabriel Soares, Diego Leonardo e  Natanael Delfino Direção de Arte: Patrícia RodriguesContra-regra: João Pedro Make: Tatiane BombardaStylist: Joseph AckonAssistente de stylist: Pedro GarcezFotógrafa: ThalyImagens Making of: Victor ZarpaEdição Making of: Alef Santz Produção de locação: Meco locaçõesProdutora de Casting: Gema ProduçõesPug: FloraCatering: Buffet Keila AvianoTatuador: Diego Tattoo 013Transporte objeto de artes: Luiz - Standart transportesTransporte de equipe: Bruno FechamentoAgradecimento: B&B MultimarcasMarketing: Mestre da Web"
B2jZtmaq0xQ,Challenge Accepted!!! #shorts #Challenge,2023-04-08T12:00:07Z,UCJNwKVYOYn-EDJR1QJg8aZw,WooHoo WHOA,26,23.27.04,23045651,601695,460,False,False,"https://www.youtube.com/playlist?list=PLWbI8_Cj42naZQAN3BI9l3l6kYYyJqtWSChallenge Accepted!!! #shorts #ChallengeDon’t forget to turn on notifications, like, & subscribe!"
4wYO-LBnEkg,Quim Barreiros - A vida de pároco (Official video),2023-04-17T19:00:09Z,UCV9mWh45ky8tVQJR3sRhnXQ,Espacial Live,10,23.27.04,136061,827,1,False,False,Quim Barreiros - A vida de pároco (2023)Tema incluído no CD - 50 anos depois - Hino D'AmizadeCD disponível em https://www.espacial.pt e em https://orcd.co/50anosdepoisESPACIAL – Onde a música acontece!...Website | https://www.espacial.ptYoutube Espacial| https://www.youtube.com/EspacialMusicaYoutube Espacial Live | https://www.youtube.com/EspacialLiveFacebook | https://www.facebook.com/Editora.EspacialInstagram | https://www.instagram.com/editoraespacialTwitter | https://twitter.com/EspacialMusicaSpotify | espacialmusica | https://spoti.fi/3sXUmjQ#QuimBarreiros #EspacialLive #EspacialMúsica
SatZUBXV9Nw,PASSEI A NOITE NO PARQUE DE CAMAS ELÁSTICAS SEM NINGUÉM ME VER!,2023-04-23T21:28:00Z,UCjaxmdb_gTWbz9XF5rzvgGg,Natan por Aí,24,23.27.04,1536513,46249,595,False,False,"CUPOM COLMEIA 10% DE DESCONTO PARA TODOS DO CANAL QUE FOREM NA MUVE INDOOR - BALNEÁRIO CAMBORIÚ.ATENÇÃO: O conteúdo deste e de todos os vídeos do canal tem como principal intuito o entretenimento. Não repita ou reproduza qualquer cena deste vídeo, seja em ambientes públicos ou privados. Todas as histórias e cenas mostradas aqui visam exclusivamente o seu entretenimento e de seus familiares.Participe do nosso grupo exclusivo do Telegram:https://t.me/natanporaiGostou? Curta e compartilhe o vídeo!Quer ver mais vídeos como esse? Então deixe o seu like para fortalecer!#NATANPORAIInscreva-se no canal:http://youtube.com/natanporaiAcompanhem também em:http://instagram.com/natanporaihttp://facebook.com/natanporaihttp://twitter.com/natanporai"
q1HTN8-IgQo,Prime MEMORY Test!! 🤯😂,2023-04-15T13:29:44Z,UCoGForHQAmk0_9rI9CABeYw,Woody & Kleiny,24,23.27.04,43845008,1414537,485,False,False,
fBJcSedk0Yo,Piruka - Anjos Não Falam,2023-04-07T10:00:36Z,UCbD26D2EMiGBb0ELWIDCRDA,Piruka,10,23.27.04,676371,25064,949,False,False,"Official Music Video by PIRUKA performing Anjos Não Falam© 2023 808-Follow PIRUKA:◍ https://linktr.ee/pirukaSmartLink:◍ https://links.altafonte.com/anjosnaofalam -Créditos:*MúsicaComposição: Piruka, ReisProdução Executiva: JEPEInstrumental: ReisGuitar: Feodor BivolLetra: PirukaMix & Master: Michael 'Mic' Ferreira-℗ © 2023 808◍ https://808.pt #Piruka #AnjosNãoFalam #Iluminado"
B-nTkWTIDyU,Maria Joana,2023-04-13T10:03:22Z,UCZJZul-jx2Y1iwQJvyuCMQQ,Nuno Ribeiro - Topic,10,23.27.04,167382,2844,88,False,False,"Provided to YouTube by Parlophone PortugalMaria Joana · Nuno Ribeiro · Calema · MarizaMaria Joana℗ 2023 Warner Music Portugal, LdaChoir: Ana AlmeidaMasterer, Mixer: Bruno GonçalvesGuitar: Bruno ScardiniVocals: CalemaChoir: Cármen MotaChoir: Delfina CerqueiraRecorder: Diogo GuerraConcertina: Filipe GachineiroCavaquinho, Viola: Joca AraújoGuitar: João BarradasRecorder: João Pedro RuelaPercussion, Viola: KoopperRecorder: KoopperPortuguese  Guitar: Luís GuerreiroGuitar: Manecas CostaChoir: Margarida AfonsoVocals: MarizaChoir: Marta AlmeidaMixer, Producer, Recorder: Nellson KlasszikVocals: Nuno RibeiroMixer: Nuno SerraChoir: Paula AlmeidaGuitar: Phelipe FerreiraProducer: RJGuitar: Rodrigo CorreiaPercussion: Toca RufarComposer, Lyricist: Antonio Mendes FerreiraComposer, Lyricist: Fradique Mendes FerreiraComposer: Nellson KlasszikComposer, Lyricist: Nuno RibeiroComposer: Phelipe FerreiraAuto-generated by YouTube."
gnxj1b50wTA,Milan-Lecce 2-0 | Leao does it again for the Rossoneri: Goals & Highlights | Serie A 2022/23,2023-04-23T18:39:50Z,UCBJeMCIeLQos7wacox4hmLQ,Serie A,17,23.27.04,1014904,19327,619,False,False,"Another immense display of talent by Portuguese, who opened the scoring with a header and finished off Lecce with his trademark run on the left flank followed by a clinical left-footed finish | Serie A 2022/23#Highlights #MilanLecce #SerieAThis is the official channel for the Serie A, providing all the latest highlights, interviews, news and features to keep you up to date with all things Italian football.Subscribe to the channel here! https://bit.ly/SERIEA_YT Find out more about the Serie A at: http://www.legaseriea.it/en/ Questo è il canale ufficiale della Serie A, dove potrai avere accesso ai momenti salienti, alle interviste, alle notizie e alle funzionalità del momento per rimanere aggiornato sulle ultime novità del campionato.Iscriviti qui al canale! https://bit.ly/SERIEA_YTPer maggiori informazioni sulla Serie A: http://www.legaseriea.it/it"
gMq-I0dejjE,Ice Spice & Nicki Minaj - Princess Diana (Official Music Video),2023-04-14T16:00:09Z,UCCdbL-yl7Qa_vurbYWdn5SA,IceSpiceVEVO,10,23.27.04,27634704,921125,63058,False,False,"Watch the official video for Ice Spice Princess Diana” Feat. Nicki MinajStream // Download Ice Spice's new single Princess Diana here: http://IceAndNicki.lnk.to/PDRFollow Ice Spice Everywhere:Facebook: https://www.facebook.com/icespicemusic1/ Twitter: https://twitter.com/icespicee_ Instagram: https://www.instagram.com/icespice TikTok: https://www.tiktok.com/icespiceeStream Ice Spice Everywhere:Spotify: https://open.spotify.com/artist/3LZZPxNDGDFVSIPqf4JuEf?si=ICdy4wAfSKuQsqSVbrpluwApple Music: https://music.apple.com/us/artist/ice-spice/1552372505 Soundcloud: https://on.soundcloud.com/k3r8E Subscribe to Ice Spice's YouTube here: https://www.youtube.com/channel/UCJTqwQj5iTHYrko04PbGI9wMusic video by Ice Spice performing Princess Diana. 10K Projects/Capitol Records; © 2023 Dolo Entertainment, Inc., under exclusive license to UMG Recordings, Inc.http://vevo.ly/IgWlO5"
zm5bL2v876s,Hit ❤️ for Real Dance #michaelmejeh #dance #youtubeshorts @caciliaofficial4619,2023-04-02T22:05:38Z,UCsNBjnhHc7xW5MDFbMqRs8g,Michael Mejeh,20,23.27.04,45520171,2200954,9493,False,False,
GSmfx6u7c3g,ENTREVISTA DE EMPREGO,2023-04-16T20:00:05Z,UCgLCZuwlhAn5Hys_06f5LJw,PIERRE ZAGO,23,23.27.04,181231,11438,556,False,False,Qualquer semelhança com uma entrevista real na Zome é pura coincidência. Ou será que não? Descobre mais em https://talento.zome.ptNota: todas as pessoas que participaram neste vídeo tiveram no final uma entrevista a sério na Zome. Isto foi apenas um quebra gelo ;)Instagram: https://www.instagram.com/pierrezago/Facebook: https://www.facebook.com/pierrezagoprodENTREVISTA DE EMPREGOPierre Zago 2023
mMbMvi4CDDE,Ex Namorada Visita a Nossa Casa (Angie Costa) | WINDOH,2023-04-13T20:58:40Z,UCjlL3AqX17cYfq0tfN4ygMQ,Windoh,24,23.27.04,411877,29418,376,False,False,📩For Business Inquiries: windoh14@hotmail.comO QUE ACHASTE DO VÍDEO? COMENTA EM BAIXO!👟Rotation (Loja de ténis): https://www.rotation.pt📸Sou mais ativo no IG: @windoh📩For Business Inquiries: windoh14@hotmail.com🐤Tt: @winndoh
tgw8aR-ENio,토카토카 댄스  TOCA TOCA TOCA dance Poppy Playtime in real life #trending #funny #poppyplaytime,2023-04-14T14:00:40Z,UC6q0-zpxE7wOSqgdKNzE-vA,ZNAK,24,23.27.04,44501661,757247,1048,False,False,Toca Toca dance from Huggy Wuggy and Mommy long legs and all from the real Poppy playtime game! #huggywuggy #funnymoments #trend
y5AzxENQ9SU,유행 찍는 방법,2023-04-10T10:00:43Z,UCDsDdULLy8bbeFfAPC2mp5w,오마이비키 OMV,24,23.27.04,39640154,1034577,3368,False,False,
6ItTniOa99A,Trollando Meu Marido Gringo (Bolada) 😂 #shortsbrasil,2023-04-19T21:00:51Z,UC4j_eemDfXMlPfb7JORBR1g,Brandon & Bruna,27,23.27.04,1606965,118959,144,False,False,"✅ Playlists Recomendadas ✅○ Gringo No Brasil: https://bit.ly/3D2TTo8○ Melhores Shorts: https://bit.ly/3WojQ8k○ Gringos: https://youtu.be/ELMCY5nsZqs💥 Nos Siga Também Nas Redes Sociais 💥 ► Instagram: https://bit.ly/3q1gidK► Tiktok: https://bit.ly/3pWROlU► Facebook: https://bit.ly/3XPOaK2Se você gosta dos nossos vídeos, pode nos apoiar com doações para:💲 PIX: brandonebruna@gmail.com 💲💲 PayPal: brandonebruna@gmail.com 💲For business inquires only, please use this email: brandonebruna@gmail.com"
4YGII2-yWnE,Funniest game of SMASH 😂,2023-04-13T15:46:10Z,UCcILXXthGExGeKAQLAIUaFQ,Pongfinity,17,23.27.04,32853354,1015817,382,False,False,"SUBSCRIBE to Pongfinity ► http://bit.ly/PongfinitySubOfficial Pongfinity Products ► https://pongfinity.store/Buy our clothing (shirts, hoodies etc) ► https://fanjoy.co/pongfinityCheck out our 2nd channel for match videos and more! ► http://bit.ly/PongfinityPlusDownload our NEW Pongfinity Duels 1v1 Multiplayer mobile game for FREE:Android: http://bit.ly/PongfinityDuelsAndroidiOS: http://bit.ly/PongfinityDuelsAppleHang out with us on social media:► Facebook (@Pongfinity): http://bit.ly/PongfinityFB► Instagram (@Pongfinity): http://bit.ly/PongfinityIG► TikTok (@Pongfinity): https://bit.ly/PongfinityTikTokYou can reach us at: media@pongfinity.com"
nokz9WgIwjI,Scary night games with Megan | Megan robot doll scared me #shorts,2023-04-05T13:15:03Z,UCFcG7cgOd2ePKx--kPft7Kg,One More,26,23.27.04,75764550,1580301,884,False,False,"❤️ Share and subscribe if you like the video🔔 Don’t forget to click the bell to make sure you never miss our videos💛 #shorts Music by Epidemic Sound 🎵: https://www.epidemicsound.com/---------------This video is made for entertainment purposes. We do not make any warranties about the completeness, safety and reliability. Any action you take upon the information on this video is strictly at your own risk, and we will not be liable for any damages or losses. It is the viewer's responsibility to use judgment, care and precautions if one plans to replicate.The following video might feature activity performed by our actors within controlled environment- please use judgment, care, and precaution if you plan to replicate.All product and company names shown in the video are trademarks™ or registered® trademarks of their respective holders. Use of them does not imply any affiliation with or endorsement by them."
-1wcilQ58hI,Starship Flight Test,2023-04-20T14:08:39Z,UCtI0Hodo5o5dUb67FeUjDeA,SpaceX,28,23.27.04,11525275,260723,14786,False,False,"Starship gave us quite a show during today’s first flight test of a fully integrated Starship and Super Heavy rocket from Starbase in Texas.  At 8:33 a.m. CT, Starship successfully lifted off from the orbital launch pad for the first time. The vehicle cleared the pad and beach as Starship climbed to an apogee of ~39 km over the Gulf of Mexico – the highest of any Starship to-date. The vehicle experienced multiple engines out during the flight test, lost altitude, and began to tumble. The flight termination system was commanded on both the booster and ship. As is standard procedure, the pad and surrounding area was cleared well in advance of the test, and we expect the road and beach near the pad to remain closed until tomorrow.With a test like this, success comes from what we learn, and we learned a tremendous amount about the vehicle and ground systems today that will help us improve on future flights of Starship. Thank you to our customers, Cameron County, and the wider community for the continued support and encouragement. And congratulations to the entire SpaceX team on an exciting first flight test of Starship!"
wy5jmYfmX5U,"Marshmello, Farruko - Esta Vida (Official Video)",2023-04-14T00:00:09Z,UCPW4ObAtDezrOGo2gjYOctg,MarshmelloVEVO,10,23.27.04,6017900,170202,3979,False,False,"Esta VidaMarshmello, Farruko (Official Video)Music:Apple Music: https://SML.lnk.to/EstaVida/applemusic Spotify: https://SML.lnk.to/EstaVida/spotify Amazon: https://SML.lnk.to/EstaVida/amazonmusicstreaming YouTube: https://SML.lnk.to/EstaVida/youtube iTunes: https://SML.lnk.to/EstaVida/itunes Deezer: https://SML.lnk.to/EstaVida/deezer TikTok: https://SML.lnk.to/EstaVida/tiktokusemysound Pandora: https://SML.lnk.to/EstaVida/pandora Marshmello: Merch https://marshmellomusic.com/collections/new-arrivalsInstagram http://instagram.com/marshmelloFacebook  http://facebook.com/marshmelloTwitter http://twitter.com/marshmelloTwitch http://twitch.tv/marshmellomusicTikTok https://tiktok.com/@marshmelloLyrics:No se puede complacer al to’ el mundo Al to’ el mundoDecidi vivir sin importar que digan soy feliz Yo cambie que conste fue pa’ bienAyy esta vida cuando tienes te quierenCuando no te olvidanWoahh ayy esta vida cuando tienes te quierenCuando no te olvidanFarruuMarshmello Bajo mundoFarru No se puede complacer al to’ el mundoAl to’ el mundo WoahhNo se puede complacer al to’ el mundoAl to’ el mundoFarruu Que hablen que digan usted viva su vida Yo vivo la mia me canse de las mentiras De tanta falsedad del mismo sistema Encontre la salida pa’to mis problemas Ahora que cambie pa’ bien no me lo tomen a malNo es que yo quiera pichar no me llamen pa janguearManito aquí to’ esta bien no lo cogas personal Seguimos siendo panas aunque tu no me ves igual Ayy esta vida cuando tienes te quierenCuando no te olvidanWoahh ayy esta vida cuando tienes te quierenCuando no te olvidanFarruuMarshmello we taking over Are you ready? Bajo mundo Carbon fiber music Decidi vivir sin importar que digan soy felizYo cambie que conste fue pa’ bienAyy esta vida cuando tienes te quierenCuando no te olvidanWoahh ayy esta vida cuando tienes te quierenCuando no te olvidanFarruuNo se puede complacer a to’ el mundoA to’ el mundoNo se puede complacer a to’ el mundoAl to el’ mundoAl to el’ mundoBajo mundoFarruko:Facebook https://www.facebook.com/FarrukoOfficialTwitter https://twitter.com/farrukoofficialInstagram https://www.instagram.com/farruko/Video Directors:Justice SilveraMichael BreslauerExecutive Producers:Christian BreslauerMichael Breslauer#Marshmello #Farruko #EstaVidaMusic video by Marshmello, Farruko performing Esta Vida (Official Video). (C) 2023 Joytime Collective under exclusive license to Sony Music Entertainment US Latin LLC"
y5IFGplZ2jQ,MATUÊ - Podpah #600,2023-04-18T23:02:00Z,UCj9R9rOhl81fhnKxBpwJ-yw,Podpah,24,23.27.04,1439618,90406,776,False,False,"BLAZEInscreva-se no Blaze com meu código 'podpah' e receba um bônus de boas-vindas.Você deve ter mais de 18 anos para usar o aplicativo Blaze. Se você tem menos de 18 anos, não jogue.----------------------------------------------------------------------------------------------------------------------------------------------------------------------------CORTES PODPAHhttps://bit.ly/cortespodpah--------------------------------------------------------------------------------------REDES DO PODPAH:Instagram@podpahTwitter@podpah--------------------------------------------------------------------------------------MATUÊ@matue----------------------------------------------------------------------------------------ANFITRIÕES:Igão - Twitter @igorcavalari               - Instagram @igaoMítico - Twitter @miticojovem               - Instagram @miticoDIREÇÃO: Alex Trevisan                           - Instagram @oalextrevisanPRODUÇÃO: Maria Carolina               -Instagram @eumariacarolinaAlexandre Corpo de Pai               -Instagram @ocorpodepaiDIREÇÃO TÉCNICA:Everton Moraes Longo               -Instagram @vermoraesMODERAÇÃO E THUMBNAILS:Zorks Studios               -Instagram @zorkstudios----------------------------------------------------------------------------------------*REGRAS DO SUPERCHAT*-PROPAGANDAS NÃO SERÃO LIDAS-SUPERCHAT APENAS COM PEDIDO DE SALVE NÃO SERÃO LIDOS-VAMOS ESCOLHER OS SUPERCHATS MAIS INTERESSANTES----------------------------------------------------------------------------------------00:00 Espera07:06 Início"
nM8XuevJ9c0,Gabriel?????,2023-04-04T02:22:05Z,UC_hlt0tC9nsclVtHaWGhbEw,Gabriel Gomes,23,23.27.04,5715734,390868,5345,False,False,
GqpLpCVf4ig,😱 Wait for it... #shorts,2023-03-23T13:00:12Z,UCflpy-GNxlahbdRdN5CRUsA,LADbible Extra,24,23.27.04,32148672,523201,1757,False,False,#LADbible
uJFJ-qM3RK4,I Survived World‘s Toughest Army Routine,2023-04-05T15:00:45Z,UCuJBpMyxlmemsQiivWPcGrQ,Browney Shorts,24,23.27.04,26085838,1620571,3502,False,False,I Survived World‘s Toughest Army Routine #shorts
T0JyvmBsz-4,Coisas para pensar durante o banho (11),2023-04-20T21:11:36Z,UCjccbzNlczaBBwZwVjBXHiA,sabfulero1,20,23.27.04,1783688,174670,460,False,False,🤔SERVIDOR DO DISCORD- https://discord.gg/Zgec5FXvHQtiktok- @sabfulero2insta- @saborilastwitter- @saborilas#shorts #minecraft
B05zAuj1dGU,HAJA BONECOS - SETENTA E NOVE (SALVADOR MARTINHA),2023-04-16T23:46:45Z,UC8O8jPZyN46FFkxE5HpHuBA,OS PRIMOS,24,23.27.04,111614,4066,61,False,False,PATREON:https://www.patreon.com/osprimosO NOSSO PODCAST:SOUNDCLOUD https://soundcloud.com/os-primos-354697382SPOTIFYhttps://open.spotify.com/show/0ZCK9tue6zOJdv2K1v1Csj?si=JSWEfO2USXKSvN5MQMJg0AITUNEShttps://podcasts.apple.com/pt/podcast/carrossel/id1489619967?l=enOS PRIMOS NA SOCIAL ESTÃO:Instagram @osprimosboyTwitter @osprimosboyEmail - osprimosbungalow@gmail.com
WO52f2MsYzk,"Raffé ft. Oruam e Mc Poze do Rodo - Desde Menorzin (prod. Mello, Honaiser)",2023-04-14T16:00:11Z,UCDiQ-LZ8dfc3cmoGBxMDS7Q,Mainstreet Records,10,23.27.04,1850205,78599,2222,False,False,"Ouça #JOGODOMILHÃO em todas as plataformas: https://ONErpm.link/jogodomilhaoSe inscreva no canal e ative o sino de notificações para não perder nenhum lançamento.Composição: Raffé, Oruam, MC Poze do Rodo, OliveiraProdução Musical: Mello, HonaiserMix: 2F-UflowMaster: 2F-UflowFicha técnica:Direção: Igor Vargas | @oigorvargasDireção de fotografia: Brandon Barcellos | @brandonbarcellosAss de câmera: Mateus Farias | @fariamateus22Direção de produção: Leandro Santos | @leandrosantos2672 Produção executiva: Bela Moraes | @prodbelamoraesProdução executiva: Luccas Raposo | @luccasraposo_Gaffer: Jon Lima | @eujonlimaAss de elétrica: Alexandre Rebello | @rabello.aAss de. Maquinária: Douglas macario @douglasrspvp | Gabriel Miranda @Gabrielrsmiranda Fotografia still: Hugo Mesquita | @hugomesqEdição: Gabriel Vitiello | @gabrielvitielloColor Grading: Ronnie Outtch | @ronnieouttchStyling: Rafael Ferrero | @rafaelferreroDireção de Arte: Carol Agyar | @carolagyarProdução de Arte: Arara Preta | @ararapreta__Ass. de Arte e Cenografia: Lelahel Real | @lelahel.realContrarregra: David Cabelinho e Damásio de Barros | @david_cabelinho_nascimentoMake up: Fabi Rodrigues | @rfabiane_©℗ Mainstreet Records"
g5Xh5ueBlOE,LEO2745 - ELA QUERIA MAIS,2023-04-07T19:00:08Z,UC8GTlXo75lFTAzt7Pizd59w,Leo2745VEVO,10,23.27.04,255070,7975,304,False,False,"LEO2745 – Ela Queria MaisOuve a Música: https://leo2745.lnk.to/ElaQueriaMaisDoLeo Segue LEO2745https://www.instagram.com/leo2745_/ https://twitter.com/leo_2745https://www.youtube.com/channel/UCJ3MAoN_u7BV9pXxsTK836gMÚSICA  Letra: LEO2745Beat: KUPTZPós-Produção: ChaylanCaptação: KUPTZMistura e Masterização: ChaylanVÍDEODireção: PRO3LEMCHILD, LEO2745Realização e Edição: PRO3LEMCHILDAtriz: CatarinaAGRADECIMENTOS - OBRIGADO A TODOS OS ENVOLVIDOS NO PROJETO! SEM VOCÊS NADA DISTO ERA POSSÍVEL! OBRIGADO ❤LETRA | LYRICSEla queria mais e mais e maisMas eu já não quero porque eu nunca fui dos taisSegui os sinaisBazei normalAgora sim tu ficas com quem gostas maisNão te vou mentirDesde aquele nosso primeiro date fiquei apaixonado por tiSinto que tenho um peso no meu corpo Sentimento me poe assimSobrecarregado De love tou enfardadoPerdido num barcoMas eu só quero seguir a minha vida sozinho porque tu não me fazes bemTenho os meus olhos vidrados na tua beleza miuda tu vens do além A curva é tão apertada e eu feito burro fico a bater os 100Coitada da minha mãe Na barriga tem um recém Ela queria mais e mais e maisMas eu já não quero porque eu nunca fui dos taisSegui os sinaisBazei normalAgora sim tu ficas com quem gostas mais#leo2745 #elaqueriamais #hiphop #hiphoppt #hiphoptuga #musicaportuguesa #portuguesemusic #hitsportugal #portugal #underground #problemchildMusic video by LEO2745 performing ELA QUERIA MAIS. © 2023 Universal Music Portugal, S.A.http://vevo.ly/IFsl1u"
B6h3Dlt3wVA,GIANT Gummy Worm #shorts,2023-03-31T08:33:42Z,UCeYTfGpNCmVhlxjQxBDrGPA,Mr DegrEE,24,23.27.04,194558801,4412754,3373,False,False,Gummy Worm Hack! Thank you for watching. Subscribe to Mr DegreeMusic: https://player.epidemicsound.com
FgTnY4G3hzM,1.000 MITOS EXTREMOS da Vida Real em 24 HORAS,2023-04-20T20:16:30Z,UCQaBi4mxFO87zLw2uM3-6-A,HERO Manteiga,24,23.27.04,462707,30231,528,False,False,"Veja como eu desmascarei 1.000 mitos da vida real● Código MANTEIGA na loja do FortniteApoia eu lá, isso ajuda demais, é sério!!!----------------------------------------------------------------• Discord do canal: https://discord.com/invite/fUEUTE2• Meu Instagram: https://www.instagram.com/hero_manteiga--------------------------------------------------------------------Contato Profissional: contato@canalmanteiga.com.br00:00 Comente BANANA pra ganhar um coraçãozinho00:15 Quem não é inscrito fica careca"
_v-Wd96t4VQ,Quando o boletim chega... I Falaidearo #shorts,2023-04-15T13:10:00Z,UCCJC7YIZytEccbU0AWQIBHA,Falaidearo,24,23.27.04,3643950,311996,446,False,False,Gostou? Se inscreva no canal e deixa o like!LOJA OFICIAL ➤ https://www.lolja.com.br/as-aventuras-de-mike/🟢LIVRO VERDE: https://amzn.to/3fEu2Kg (As Aventuras de Mike 3: Mudando de Casa)🟠LIVRO LARANJA: https://amzn.to/3TfvJMN (As Aventuras de Mike 2: O Bebê Chegou)🔵LIVRO AZUL: https://amzn.to/3eiSNeL (As Aventuras de Mike 1)🟣LIVRO ROXO: https://amzn.to/3SSRaTV (As Aventuras de Mike: O Livro Interativo)- - - - - - - - - - - - - - - - - - - - - - - - - - - - - - - - - - - - - - - - - - - - - - - - - - - - - - - - - - - - - - -Segue a gente no Instagram:@manudigilio e @ogabrieldearoContato Profissional:comercial@dearoproducao.com- - - - - - - - - - - - - - - - - - - - - - - - - - - - - - - - - - - - - - - - - - - - - - - - - - - - - - - - - - - - - - -Apresentação: Gabriel Dearo e Manu DigilioRoteiro: Matheus KodakaDireção: Lucas Precinoto Edição: EurixMúsicas do vídeo: epidemicsound.com/
brrUwsYFD18,me diga seu nome me diga 🤣 #shorts,2023-04-05T20:07:16Z,UCk7PLqymO8AziWRbBu8jeOA,BruninZor,24,23.27.04,3737518,313113,1652,False,False,lives de segunda à sexta 16h! REDES SOCIAIS Instagramhttps://www.instagram.com/brunozzor Twitterhttps://twitter.com/Brunozor Tiktokhttps://bit.ly/3xjMtZl #bruninho #bruninzor #shorts
