video_id,title,publish_time,channelId,channel_title,category_id,trending_date,views,likes,comment_count,comments_disabled,ratings_disabled,description
TdSzSzE4nUg,"NAIHAR I рдирдИрд╣рд░ - New Bhojpuri Movie I B4U BHOJPURI 2023 | Gaurav jha, Amrapali Dubey",2023-04-15T01:00:12Z,UCIobY5Y-ly9Bo458yjy36OQ,B4U Bhojpuri,1,23.27.04,7701099,56246,1539,False,False,"#AMRAPALIDUBEY #GAURAVJHA #naihar #newbhojpurimovie #bhojpurimovie #b4ubhojpuri #aamrapalidubey #aamrapalifanpage #sanjaypandey #mayayadav #trendingbhojpurimovie #papakibitiya         B4U MOTION PICTURES PRESENTS IN ASSOCIATION WITH HIGH IQ ENTERTAINMENT LLP реЮрд┐рд▓реНрдо - рдирдИрд╣рд░рд╕реНрдЯрд╛рд░ рдХрд╛рд╕реНрдЯ- рдЧреМрд░рд╡ рдЭрд╛ , рдЖрдореНрд░рдкрд╛рд▓реА рджреБрдмреЗ , рд░рдЬрдиреАрд╢ рдЭрд╛ , рд╢реНрд░рджреНрдзрд╛ рдирд╡рд▓ , рд╕рдВрдЬрдп рдкрд╛рдВрдбреЗ , рдорд╛рдпрд╛ рдпрд╛рджрд╡ , рд░рд╛рдХреЗрд╢ рдХреБрдорд╛рд░ , рдкреНрд░реЗрд░рдгрд╛ рд╕реБрд╖рдорд╛ , рдмрдмрд▓реВ рдЦрд╛рди , рдЬреЗ рдиреАрд▓рдо , рд╕реНрд╡реЗрддрд╛ рд╡рд░реНрдорд╛ , рд╕рдВрддреЛрд╖ рд╢реНрд░реАрд╡рд╛рд╕реНрддрд╡ , рд╕реЛрдирд┐рдпрд╛ рдорд┐рд╢реНрд░рд╛ , рдмреГрдЬреЗрд╢ рддреНрд░рд┐рдкрд╛рдареА , рд╕реА рдкреА рднрдЯреНрдЯ , рдкрд▓реНрд▓рд╡реА рд╕рд┐рдВрд╣рдирд┐рд░реНрджреЗрд╢рдХ тАУ рдЕрдЬрдп рдХреБрдорд╛рд░ рдЭрд╛рд╕рдВрдЧреАрддрдХрд╛рд░- рдУрдо рдЭрд╛рдЧреАрддрдХрд╛рд░- ,рдЕрд░рд╡рд┐рдиреНрдж рддрд┐рд╡рд╛рд░реА , рд╡рд┐рдирдп рдирд┐рд░реНрдорд▓ рдЧрд╛рдпрдХ:- рдУрдо рдЭрд╛ , рдкреНрд░рд┐рдпрдВрдХрд╛ рд╕рд┐рдВрд╣ , рдордорддрд╛ рд░рд╛рдЙрдд , рдкреНрд░рд┐рдпрдВрдХрд╛ рдореМрд░реНрдпрд╛ , рд╕рд░реЛрдЬ рдореМрд░реНрдпрд╛рдХрдерд╛ рдкрдЯрдХрдерд╛ рд╕рдВрд╡рд╛рдж - рдЕрд░рд╡рд┐рдиреНрдж рддрд┐рд╡рд╛рд░реАрдЫрд╛рдпрд╛рдВрдХрди- рд╣рд░реАрд╢ рд╕рд╛рд╡рдВрдд рдХреЛрд░рд┐рдпреЛрдЧреНрд░рд╛рдлрд░ - рдкреНрд░рд╡реАрдг рд╕реИрд▓рд╛рд░рдЖрд░реНрдЯ рдбрд╛рдпрд░реЗрдХреНрдЯрд░ - рд╕рдВрдЬрдп рдХреБрдорд╛рд░рд╕рдВрдХрд▓рди - рдЧреБрд░реНрдЬрдВрдд рд╕рд┐рдВрд╣рдкреЛрд╕реНрдЯ рдкреНрд░реЛрдбрдХреНрд╢рди - 3 рд╕реНрдЯреВрдбрд┐рдпреЛрдХрд╛рд░реНрдпрдХрд╛рд░реА рдирд┐рд░реНрдорд╛рддрд╛ HIGH IQ - рд╕реБрднрд╛рд╖ рдЪрд╡реНрд╣рд╛рдгрдирд┐рд░реНрдорд╛рддрд╛ - рд╕рдВрджреАрдк рд╕рд┐рдВрд╣, рдЕрд░рд╡рд┐рдиреНрдж рдХреБрдорд╛рд░ рдЕрдЧреНрд░рд╡рд╛рд▓ рдореНрдпреВрдЬрд┐рдХ,рд╕реЕрдЯреЕрд▓рд╛рдЗрдЯ рдФрд░ рдбрд┐рдЬрд┐рдЯрд▓ рдкрд╛рд░реНрдЯрдирд░ - B4U рднреЛрдЬрдкреБрд░реАB4U рдЯреАрдо:B4U рдЯреАрдо - рдорд╛рд░реБрдж рд╢рд░реНрдорд╛, рдиреЗрд╣рд╛ рдЙрдкрд╛рдзреНрдпрд╛, рд╡рд┐рд╢рд╛рд▓ рдпрд╛рджрд╡FILM- NAIHARSTARCAST- Gaurav jha, Amrapali dubey, Rajneesh jha, Shradha naval, Sanjay pandey, Maya Yadav, Rakesh Kumar,Prerna sushma, Bablu khan, Jneelam,Shweta verma, SantoshSrivastava,Soniya Mishra,Brijesh tripathi, C.P.Bhatt, Pallavi SinghDIRECTOR- Ajay Kumar JhaMUSIC DIRECTOR-Om jhaLYRICS тАУ Arvind Tiwari, Vinay Nirmal, SINGER- Om jha, Priyanka Singh , Mamta    raut , Priyanka maurya, Saroj mauryaSTORY SCREEN PLAY &Dialogue- Arvind tiwari CINEMATOGRAPHER-Harish SawantCHOREOGRAPHER- Praveen SailarART DIRECTOR- Sanjay KumarEDITOR- Gurjant singhPOST PRODUCTION- 3 STUDIOEXECUTIVE PRODUCER тАУ HIGH IQ- SUBHASH CHAVHANPRODUCER- SANDEEP SINGH, ARVIND KUMAR AGARWALMusic, satellite and digital partner- B4U BHOJPURIB4U TEAMB4U TEAM- MARUD SHARMA (E.P) NEHA UPADHYAY, VISHAL YADAV"
s6ZEER_Itqg,I loveтЭд youЁЯе░ papaЁЯе░ЁЯШШ#shorts,2023-04-04T15:57:00Z,UCgqeg-bYH6kVnladDEyiFpA,Super Se Uper Vlogs,22,23.27.04,12783030,167272,60,False,False,
DF9CROanDjU,рдЧрд╛рдВрд╡ рд╡рд╛рд▓рд╛ рдЭреЛрдкрдбрд╝рд╛ рдмрдирд╛рдпрд╛ЁЯЫЦ Part-1/  ghamu saran / Jhopdi banane ka tarika #shorts #diycrafts,2023-04-18T14:33:30Z,UC3U1vy0Qk-UTkDrKEc07D1g,рдШрдореБ Saran,22,23.27.04,10794810,392121,734,False,False,@DivyaGhamu Your Queries:-how to make diy jhopadi? home made jhopadi how to decorate jhopda at home?How to make village house with cardboardHighlights -Gatte ki jhopdijhopadi house designsJhopdi decorationJhopdi making materialsVillage house makingVillage model house#diy #villagehouse #рдШрдореБ_рд╕рд╛рд░рдг #dailyvlog #shortvideo #craftideas #ytshorts #ghamusaran #new #trendy #deshilife #villagelife #villagevlog #newlook
QwIZa59Q-zA,OMAN VS SAUDI ARABIA || ACC MEN'S PREMIER CUP || MATCH 17 || Road To Asia Cup,2023-04-26T14:59:07Z,UCreBLWjg751-BcFQFtNPPtA,OSR Sports,17,23.27.04,194467,2024,1,False,False,"OSR Sports is authorized to upload this video. Using of this video on other channels without prior permission will be strictly prohibited. (Embedding to the websites is allowed)рдпрд╕ рдЪреНрдпрд╛рдирд▓ рдорд╛ рд░рд╣реЗрдХрд╛  Video рд╣рд░реБ рдХрдкрд┐, Download рдЧрд░реА рдЕрдиреНрдп Channel рдорд╛ upload рдЧрд░реЗрдХреЛ рдкрд╛рдПрдорд╛ рдкреНрд░рдЪрд╛рд▓рд┐рдд рдХрд╛рдиреБрди рдмрдореЛрдЬрд┐рдо рдХрдбрд╛ рднрдиреНрджрд╛ рдХрдбрд╛ рдХрд╛рд░рдмрд╛рд╣реА рдЧрд░рд┐рдиреЗрдЫ ред рд░ рд╕реЛ Channel рд▓рд╛рдИ рдмрдиреНрдж рдЧрд░рд┐рджрд┐рдиреЗ рдЫреМ ред"
xx0XqvM5y2o,Hardest Trick Shot To Ever Land!,2023-04-23T12:14:18Z,UChK6a3Ro3po3fUfAm3_MyUQ,Jojo Sim,24,23.27.04,13715031,252220,139,False,False,
N_c3UyRc1N0,MARTIN (2023) New Release South Hindi Dubbed Movie | South Indian Blockbuster Movie,2023-04-19T12:42:35Z,UCg4VLww62T2Sgt1f_qJqsyw,Orbit cinema,22,23.27.04,5543144,41298,0,False,False,"#martinfullmovie2023MARTIN (2023) New Release South Hindi Dubbed Movie | South Indian Blockbuster Moviemartin full movie 2023,martin full movie 2023 download,martin full movie 2023 hindi,martin full movie 2023 in hindi dubbed south,batang quiapo coco martin full movie 2023,coco martin full movie 2023,ang panday coco martin full movie 2023,new martin full movie 2023,panday coco martin full movie 2023,new south movie 2023 full movie hindi dubbed martin,martin full movie in hindi dubbed south 2023 download,martin full movie hindi dubbed 2023,manipuri film full movie 2023 gokul abenao martin,fpj movies action full movie coco martin 2023,batang quiapo coco martin full movie april 6 2023,batang quiapo coco martin full movie april 5 2023,batang quiapo coco martin full movie april 3 2023,batang quiapo coco martin full movie feb 15 2023,fpj batang quiapo full movie coco martin february 14 2023,batang quiapo coco martin full movie feb 17 2023,batang quiapo coco martin feb 27 2023 full movie,batang quiapo coco martin feb 21 2023 full movie,batang quiapo coco martin full movie march 14 2023,love story full movie tagalog 2023 coco martin,martin full movie release date 2023,martin full movie hindi dubbed 2023 dhruva sarja,martin full movie hindi dubbed 2023 update,martin movie 2023 download,martin full movie in hindi dubbed south 2023 trailer,martin full movie in hindi dubbed south 2023 release date,martin full movie in hindi dubbed south 2023 live,martin full movie in tamil dubbed south 2023,martin full movie in hindi dubbed south 2023,tamil movies 2023 full movie in hindi dubbed martin,new tamil movies 2023 full movie hindi dubbed martin,martin 2023 new released full hindi dubbed movie,martin 2023 full movie download,batang quiapo coco martin full movie episode feb 14 2023,batang quiapo coco martin full movie episode feb 20 2023,fpj batang quiapo coco martin full movie 2023,batang quiapo coco martin feb 22 2023 full movie,martin full movie hd 2023,martin 2023 full movie hindi dubbed,martin movie 2023 hindi dubbed,martin movie 2023 hindi,martin movie 2023 hindi dubbed download,martin 2023 full movie hindi dubbed update,martin full movie in hindi south 2023,martin new south movie 2023 full movie hindi dubbed,martin full movie hindi 2023,sauth hindi movie 2023 full movie martin,martin full hd movie 2023,martin full movie 2023 in hindi,martin full movie in 2023,martin full movie south indian 2023,martin 2023 full movie in hindi dubbed,martin tamil movies 2023 full movie in hindi dubbed,martin full movie in hindi dubbed south 2023 dhruva sarja,martin full movie in hindi 2023,martin full movie in hindi dubbed 2023,south indian movies dubbed in hindi full movie 2023 martin,martin full movie in hindi dubbed south new 2023,2023 ka martin movie,martin movie 2023 ka,martin kannada full movie 2023,martin movie 2023 full movie,martin movies 2023 full movie south in hindi dubbed,south movie 2023 martin full movie,movies 2023 full movie coco martin,batang quiapo coco martin full movie march 13 2023,hindi dubbed movies 2023 full movie martin,batang quiapo coco martin full movie march 28 2023,batang quiapo coco martin full movie march 16 2023,batang quiapo coco martin full movie march 24 2023,martin full movie new 2023,martin hindi full movie 2023 new,martin full movie in hindi dubbed south 2023 new,new south full movie 2023 martin,new hindi movie 2023 full movie martin,hindi movie 2023 full movie new releases martin,new south movie 2023 full movie hindi martin,hindi new movie 2023 full movie hindi dubbed martin,new south movie 2022 full movie hindi dubbed 2023 martin,dhurva new south movie 2023,south new movie 2023 hindi dubbed dhruva sarja,new south movie 2023 dhruva sarja,south new movie 2023 hindi dubbed dhruva,south new movie 2023 hindi dubbed dhruva sarja martin,new south movie 2023 dhruva sarja martin,dhruva sarja south new movie 2023 hindi dubbed,dj dhruva movie,dj dhruva south movie,dj dhruva"
fBQxQeRZeaA,рд░рдмрд┐рдорд╛рдерд┐ рдХрд╕реНрд▓реЗ рдЧрд░реНрдпреЛ рдПрдХреНрдХрд╛рд╕реАрдЖрдХреНрд░рдордг рдмреЛрд▓реЗ рдкреНрд░рддреНрдпрдХреНрд╖рджрд░реНрд╢реА - рднрдиреНрдЫрди рд░рд╡рд┐рд▓рд╛рдИ рд╣рд╛рдиреЗрдХреЛ рдвреБрдВрдЧрд╛ рд╣рд╛рдореАрд▓рд╛рдИ рд▓рд╛рдЧреНрдпреЛ,2023-04-23T13:32:45Z,UCmParc4a14EKrENcME-9OOA,Smart TV,25,23.27.04,207372,4015,291,False,False,рд░рдмрд┐рдорд╛рдерд┐ рдХрд╕реНрд▓реЗ рдЧрд░реНрдпреЛ рдПрдХреНрдХрд╛рд╕реАрдЖрдХреНрд░рдордг рдмреЛрд▓реЗ рдкреНрд░рддреНрдпрдХреНрд╖рджрд░реНрд╢реА - рднрдиреНрдЫрди рд░рд╡рд┐рд▓рд╛рдИ рд╣рд╛рдиреЗрдХреЛ рдвреБрдВрдЧрд╛ рд╣рд╛рдореАрд▓рд╛рдИ рд▓рд╛рдЧреНрдпреЛ**************************************************************************Interview With Rabi Lamichhane ChunabHost - Jevish PoudelCamera - Shalik Ram NeupaneEdit - Jevish PoudelSmart TV - 9843934560Smart TV Smart_TV******************************************************************Subscribe ushttps://www.youtube.com/smarttv1@SMARTTV1 Smart TV #Smart_TVLike us onFacebook:https://www.facebook.com/esmartkhabarOfficial Website: https://esmartkhabar.com/┬йSmart TV#RabiLamichhaneSmart TV is authorized to upload this video. Using of this video on other channels without prior permission will be strictly prohibited. (Embedding to the websites is allowed)
g7GwVwsqucU,beta beti mein anter bhedbhaav story l Sonam Prajapati Shorts,2023-04-14T10:30:11Z,UCND5ppDpEt5pVqX-bHGpcjA,Sonam Prajapati team,22,23.27.04,24909172,535014,625,False,False,"Business Inquiry: sonam.official50@gmail.com______________________________________тЦ║тЦ║Subscribe Link for sonam prajapati :https://www.youtube.com/c/SonamPrajapatiaтЦ║тЦ║Subscribe link for ┬аSonam Prajapati Vlogs Channel:https://www.youtube.com/channel/UCKXibLTQ_ijPoFyWxf2juGA?view_as=subscriberтЦ║тЦ║Subscribe link For Sonam Prajapati team Channelhttps://www.youtube.com/channel/UCND5ppDpEt5pVqX-bHGpcjA/videosтЦ║тЦ║Subscribe link For My Sister Channel Dance With Vandana https://www.youtube.com/channel/UCAQlKCfUMsMbxFZ7iK86_nA/videosтЦ║тЦ║Subscribe link For Vandana Prajapati Vloghttps://www.youtube.com/channel/UCboFoXfar6344PLyTtHvf4A/videos______________________________________My social LinksтЦ║тЦ║instagram ┬а https://www.instagram.com/thesonamprajapati/тЦ║тЦ║Facebook fan page ┬а https://www.facebook.com/TheSonamPrajapati/тЦ║тЦ║Facebook fan page Team Sonam | Facebook______________________________________AUDIO DISCLAIMER/CREDITS тАУ Music from Epidemic Sound (http://www.epidemicsound.com)DISCLAIMER: The information provided on this channel and its videos is for general purposes only, doesnt intend to hurt anyone sentiment religion, etc., and should not be considered as professional advice as these videos are for Fun."
zPLd5V3LKcE,Chomtu ki lassi !! #shorts #ashortaday #rajatp_here,2023-04-17T03:07:13Z,UCsVLjuLlsIsmIIQMW2s_zag,Rajat shorts !!,27,23.27.04,9109142,162636,149,False,False,
p3cRKPv4ojU,Chal рдЕрдм Jail рдореЗрдВ ЁЯШВ Official the jeet || deepesh zo || mr roshan || #sad #short #shorts,2023-04-16T14:31:31Z,UCoBCrvDnfOB3Hm8zF3RrAoA,Official the jeet,22,23.27.04,8593547,295308,87,False,False,
wKN3Ic4ki6o,End miss mat karna ЁЯдг (Topper Vs backbencher) #shorts # #funny,2023-04-16T14:33:12Z,UC5apxzE3aEOpvP0XkeuW8mw,Bobby chourasiya,22,23.27.04,21694578,1278055,1355,False,False,
zm5bL2v876s,Hit тЭдя╕П for Real Dance #michaelmejeh #dance #youtubeshorts @caciliaofficial4619,2023-04-02T22:05:38Z,UCsNBjnhHc7xW5MDFbMqRs8g,Michael Mejeh,20,23.27.04,45520171,2200957,9493,False,False,
M1DTD6QNKLg,UAE VS SINGAPORE || ACC MEN'S PREMIER CUP || MATCH 11 || Road To Asia Cup,2023-04-23T12:43:05Z,UCreBLWjg751-BcFQFtNPPtA,OSR Sports,17,23.27.04,288487,2986,2,False,False,"OSR Sports is authorized to upload this video. Using of this video on other channels without prior permission will be strictly prohibited. (Embedding to the websites is allowed)рдпрд╕ рдЪреНрдпрд╛рдирд▓ рдорд╛ рд░рд╣реЗрдХрд╛  Video рд╣рд░реБ рдХрдкрд┐, Download рдЧрд░реА рдЕрдиреНрдп Channel рдорд╛ upload рдЧрд░реЗрдХреЛ рдкрд╛рдПрдорд╛ рдкреНрд░рдЪрд╛рд▓рд┐рдд рдХрд╛рдиреБрди рдмрдореЛрдЬрд┐рдо рдХрдбрд╛ рднрдиреНрджрд╛ рдХрдбрд╛ рдХрд╛рд░рдмрд╛рд╣реА рдЧрд░рд┐рдиреЗрдЫ ред рд░ рд╕реЛ Channel рд▓рд╛рдИ рдмрдиреНрдж рдЧрд░рд┐рджрд┐рдиреЗ рдЫреМ ред"
q1HTN8-IgQo,Prime MEMORY Test!! ЁЯдпЁЯШВ,2023-04-15T13:29:44Z,UCoGForHQAmk0_9rI9CABeYw,Woody & Kleiny,24,23.27.04,43845008,1414544,485,False,False,
nYBPimqIRQ8,"Khoon me mere kanjoosi, kanjoosi me mera khoonЁЯШм ||Kanjoos dad|| #comedy #shorts #chetanmonga",2023-04-16T08:40:00Z,UCZLOlM5df0CXW9bP5MAeE7A,Chetan Monga Vlogs,22,23.27.04,16112198,584970,661,False,False,Xuv700 Delivery Vlog- https://youtu.be/dhjDEJmr4Cw
5TTOtat73Pk,Instant Mango Cutter Review ЁЯШН| Instant Watermelon Cutter Review ЁЯШН | @sosaute #shorts,2023-04-13T13:15:00Z,UCm3uwvJw2KHp4aWRjj_IWTQ,So Saute,26,23.27.04,16838982,701904,1247,False,False,"Instant Mango Cutter Review ЁЯШНand Watermelon Cutter Review ЁЯШНNew channel : https://www.youtube.com/channel/UC92EFrsOrH7oCyTjV5gG4bwwhats cookin, good lookinI post reviews of new products in the food industry and also fun and quiry recipes.Be a part of this family тЭдя╕П Press the subscribe button and the bell icon too.Business Mail Id:sosaute@qyuki.comInstagram:www.instagram.com/sooosauteFacebook:Zaamana ho gaya app delete karey.#sosaute #amazonreview"
sC6nBbdHAVw,Maa k barabar koi nahi тЭдя╕П #gauravaroravlogs #youtubeshorts #shorts,2023-04-06T15:30:22Z,UCZrBQSMI1mme3xGHl6hqfNQ,Gauravaroravlogs ,24,23.27.04,28943812,526693,585,False,False,
t-RuxgQogCw,School ki masti ЁЯШВтЭдя╕П Bhaang wala Samosa ЁЯШВтЭдя╕П End tak zaroor dekhna тЭдя╕П #shorts,2023-04-16T11:08:53Z,UClO7QTL3RLMGW9Px4Q8znog,sagar kalra (Shorts),22,23.27.04,8194653,295944,186,False,False,
htf7ja8LLBg,SHIRT CHALLENGE тЪ╜я╕ПЁЯСХ,2023-04-09T06:55:00Z,UClk5AUhvoAzN41inRfdLPYw,Celine & Michiel,24,23.27.04,62435563,1966290,1868,False,False,Abonneer voor meer! :)
ffgsBM0RoUE,PizzaЁЯНХ Vs MomosЁЯеЯЁЯдд #shorts #trendingshorts #foodlover #tasty #viral #meghachaube,2023-04-13T13:32:45Z,UCAugBD4C-716-q4vGxzaF2g,Megha Chaube Shorts,22,23.27.04,12880316,606877,534,False,False,
4yDJrsVgvUE,"WAI WAI QUICK PYRO COMEDY CLUB WITH CHAMPIONS | EPI 56 | Dayahang Rai, Miruna Magar, Upendra Subba",2023-04-10T15:30:09Z,UCNU2Xe6kr6OJDxWGDXa66gQ,OSR Reality,24,23.27.04,1623093,33726,1419,False,False,"WAI WAI QUICK PYRO COMEDY CLUB WITH CHAMPIONS | EPI 56 | Dayahang Rai, Miruna Magar, Upendra SubbaExecutive Producer: Usha Poudel Rijal, Rabindra Kumar Rijal SashiMarketing Director: Puspa AryalOperations Director: Sarbesh RijalMusic Director: RaPraveen ShresthaColor: Prabin ShresthaVFX: Rajesh Shah, Bibek RijalChief Assistant Director: Shraddha PrasaiDOP: Shivaram ShresthaPost Production Head: Gambir RajkarnikarChief Editor: Anil ShresthaArtist: Umesh Rai (Fulandeko Aama), Suman Karki, Sajan Shrestha, Bkey Agarwal, Kailash Karki, Pawan Bhattarai, Mexam Gaudel, Usha RajakWriter: Pujan Adhikari, Sushant Basyal, Suman KoiralaDirector: Bkey AgarwalProject Head : Bishal BhandariSyndication and Distribution Consultant: Mahesh RijalProduction Supervisor: Rajuman ShresthaProduction Controller : Tushar LamsalPublicity Designer: Ujjwal Shrestha, Binod KhadkaAsst. Color: Swoyam ShresthaOnline Editor: Shree Krishna DhakalCamera Handlers: Avesh Bajracharya, Sudeep Budhathoki, Sushil Baniya, Nirajan Karki, Roshan Shrestha, Deepak Bista, Dhurba Raj JoshiIT Department: Abhishek SitaulaMarketing Manager: Mukunda RimalPublicity and Promotion: Sunil PhuyalSet Designer: Raj Kumar Patel (Stage Decor Service)Light Designer: Binod ShresthaMusicians: Tabala - Jay prakash Joshi(Jp)Keys    - Dinesh Raj RegmiGuitar - Suraj PradhanOcto Pad- Bhupendra RasailiBass- Kushal ThapaSound: ISSMixing Management: Kumar Sunuwar, Dhiroj RasailiAdmin Head: Bikash BhandariFinance Head: Hiran Kumar BasnetFinance Department: Binod Bhattrai, Niroj Shah, Ram Mani AdhikariMUA: DeeVan Unisex SaloonStylist: Sudeshna MaharjanWardrobe: Kusum Creation, Sri Raj TailorsDeepa Shree Niraula's Wardrobe and Accessories:Kaira Boutique (Rojina Shrestha), Almashringar Ornaments by AlinaEquipment: Aaha Media And Event Pvt. Ltd.Electrician: Utsav SubediLight Men: Sundar Shrestha, Naran Gurung, Madan Nepali, Basanta Sigdel, Govinda Pokhrel, Tirtha TamangProduction Assistant: Manoj Sunar, Karan BasyalOffice Asst.: Devi UgarkotiSpot Boys: Sujan Karki and TeamDigital Partner: OSR DigitalSpecial Thanks: COCO Cafe"
hNvnUlJ9gbk,ф╗░цЬЫцШЯчй║я╝Ъ шАБхЕмщАЩцШпхРГф║ЖчЖКх┐Гш▒╣хнРшЖ╜ф║ЖхЧОя╝Я#shorts,2023-03-24T07:14:07Z,UCM9yZqLGr2iT__9gDfrQ4QA,цо╡хнРщлШцЙЛ,22,23.27.04,64910826,474837,709,False,False,цо╡хнРцЙЛх╛ЮшЧЭшбУшжЦшзТхИЖф║лцХЕф║Ля╝МхУБшоАф╕Нф╕АцигчЪДф║║чФЯч╢Уцн╖я╝Мцнбш┐ОщЧЬши╗хПКш╜ЙчЩ╝я╝Б
H1iSwjgBWJ8,Sigma Pellam  Episode -1 #shorts #telugu #funny #comedy,2023-04-17T12:40:00Z,UCWWH9KvhZ7oxCL90J-4iJ7w,Crazy Cherryboy,23,23.27.04,26009106,686294,625,False,False,"Sigma Pellam  Episode -1  music Credits SONG  :-WORTH NOTHING (Fast & Furious: Drift Tape/Phonk Vol 1)ARTIST :-TWISTEDALBUM :-WORTH NOTHINGLICENCES :-UMG (on behalf of APG Inc тАУ FF10); Warner Chappell, ASCAP, Kobalt Music Publishing, UNIAO BRASILEIRA DE EDITORAS DE MUSICA - UBEM, LatinAutor - Warner Chappell, AMRA, LatinAutorPerf, LatinAutor, SOLAR Music Rights Management, and 3 music rights societies"
95cTzLE6grw,Choose your banana challenge ЁЯШВ Who has how many real bananas? ЁЯШ│ #shorts Best video by Hmelkofm,2023-04-17T05:00:04Z,UCE8o2AWXA7SXZj7dcTQGZRA,Hmelkofm,24,23.27.04,21123518,264678,73,False,False,Thank you for watching our channel Hmelkofm! Please subscribe to our channel and don't forget to turn on the notification button! #shorts #hmelkofm
suv4EnWrVoA,Sir ka birth mark coverup hua kya #maheshchavan #shorts,2023-04-14T08:29:57Z,UCqTmCuf2W7IMrvYrxFlmufQ,Mahesh Chavan,24,23.27.04,10891109,781384,1925,False,False,
cFB51JRwMUE,WAI WAI QUICK PYRO COMEDY CLUB WITH CHAMPIONS | EPI 58 | Bipin Kakri Keki Adhikari Arpan Thapa,2023-04-24T15:30:08Z,UCNU2Xe6kr6OJDxWGDXa66gQ,OSR Reality,24,23.27.04,827614,19255,811,False,False,"WAI WAI QUICK PYRO COMEDY CLUB WITH CHAMPIONS | EPI 58 | Bipin Kakri, Keki Adhikari, Arpan ThapaExecutive Producer: Usha Poudel Rijal, Rabindra Kumar Rijal SashiMarketing Director: Puspa AryalOperations Director: Sarbesh RijalMusic Director: RaPraveen ShresthaColor: Prabin ShresthaVFX: Rajesh Shah, Bibek RijalChief Assistant Director: Shraddha PrasaiDOP: Shivaram ShresthaPost Production Head: Gambir RajkarnikarChief Editor: Anil ShresthaArtist: Umesh Rai (Fulandeko Aama), Suman Karki, Sajan Shrestha, Bkey Agarwal, Kailash Karki, Pawan Bhattarai, Mexam Gaudel, Usha RajakWriter: Pujan Adhikari, Sushant Basyal, Suman KoiralaDirector: Bkey AgarwalProject Head : Bishal BhandariSyndication and Distribution Consultant: Mahesh RijalProduction Supervisor: Rajuman ShresthaProduction Controller : Tushar LamsalPublicity Designer: Ujjwal Shrestha, Binod KhadkaAsst. Color: Swoyam ShresthaOnline Editor: Shree Krishna DhakalCamera Handlers: Avesh Bajracharya, Sudeep Budhathoki, Sushil Baniya, Nirajan Karki, Roshan Shrestha, Deepak Bista, Dhurba Raj JoshiIT Department: Abhishek SitaulaMarketing Manager: Mukunda RimalPublicity and Promotion: Sunil PhuyalSet Designer: Raj Kumar Patel (Stage Decor Service)Light Designer: Binod ShresthaMusicians: Tabala - Jay prakash Joshi(Jp)Keys    - Dinesh Raj RegmiGuitar - Suraj PradhanOcto Pad- Bhupendra RasailiBass- Kushal ThapaSound: ISSMixing Management: Kumar Sunuwar, Dhiroj RasailiAdmin Head: Bikash BhandariFinance Head: Hiran Kumar BasnetFinance Department: Binod Bhattrai, Niroj Shah, Ram Mani AdhikariMUA: DeeVan Unisex SaloonStylist: Sudeshna MaharjanWardrobe: Kusum Creation, Sri Raj TailorsDeepa Shree Niraula's Wardrobe and Accessories:Kaira Boutique (Rojina Shrestha), Almashringar Ornaments by AlinaEquipment: Aaha Media And Event Pvt. Ltd.Electrician: Utsav SubediLight Men: Sundar Shrestha, Naran Gurung, Madan Nepali, Basanta Sigdel, Govinda Pokhrel, Tirtha TamangProduction Assistant: Manoj Sunar, Karan BasyalOffice Asst.: Devi UgarkotiSpot Boys: Sujan Karki and TeamDigital Partner: OSR DigitalSpecial Thanks: COCO Cafe"
