video_id,title,publish_time,channelId,channel_title,category_id,trending_date,views,likes,comment_count,comments_disabled,ratings_disabled,description
Dj4qfZK1ITU,"ЁЭРМЁЭРАЁЭРШЁЭРАЁЭРКЁЭРО ЁЭРВЁЭРЗЁЭРИЁЭРНЁЭРО ЁЭРДЁЭРйЁЭРвЁЭРмЁЭРиЁЭРЭЁЭРЮ-ЁЭЯПЁЭЯР || Nepali Tele Serial | Tika Sanu, Kamala Ghimire,Hiuwala Gautam ЁЭЯПЁЭЯУ ЁЭРАЁЭРйЁЭРл ЁЭЯРЁЭЯОЁЭЯРЁЭЯС",2023-04-15T13:51:55Z,UCcDToua9LQCFBxeAm0aw_Kg,Aalap Studio,24,23.27.04,410565,9127,225,False,False,"Aalap Studio Presents:- New Nepali Tele Serial MAYAKO CHINO EPISODE-12 Only on Aalap Studio Official Youtube Channel  MAYAKO CHINO is a female-dominated telefilm that seeks to portray the reality of what is happening in society. How many children are orphaned in Nepal due to the distortion and inconsistency in love relationships.MAYAKO CHINO  is a telefilm that seeks to show the impact of interracial love affair on society between rich and poor.Getting education is a child's right, but many children in Nepal have not been able to go to school because they do not have good parents.   The caterpillar of the tele-serial, Kamala, who herself has struggled a lot to read and will go on a separate campaign tomorrow to teach such children who do not have good parents.            рдЯреЗрд▓рд┐ рдЪрд▓рдЪрд┐рддреНрд░  рдорд╛рдпрд╛рдХреЛ рдЪрд┐рдиреЛ рд╕рдорд╛рдЬрдорд╛ рдШрдЯрд┐рд░рд╣реЗрдХреЛ рдШ*рдЯреН*рдирд╛рдХреЛ  рдпрдерд╛рд░реНрде рдЪрд┐рддреНрд░рдг рдЧрд░реНрди рдЦреЛрдЬрд┐рдПрдХреЛ рдПрдХ рдирд╛рд░реА  рддрдерд╛ рдмрд╛рд▓рдмрд╛рд▓рд┐рдХрд╛ рдкреНрд░рдзрд╛рди рдЯреЗрд▓рд┐ рдЪрд▓рдЪрд┐рддреНрд░ рд╣реЛ  ред рдпрд╕рдорд╛ рдзрдиреА рд░ рдЧрд░рд┐рдм рдмрд┐рдЪрдХреЛ рдкреНрд░реЗрдо рд╕рдореНрдмрдиреНрдз, рдЕрдиреНрддрд░реНрдЬрд╛рддрд┐рдп рдкреНрд░реЗрдо рд╕рдореНрдмрдиреНрдзрд▓реЗ рд╕рдорд╛рдЬрдорд╛ рдкрд░реНрдиреЗ рдЕрд╕рд░рд▓рд╛рдЗ рджреЗрдЦрд╛рдЙрди рдЦреЛрдЬрд┐рдПрдХреЛ рдЫ  ред             рдиреЗрдкрд╛рд▓рдорд╛ рдкреНрд░реЗрдо рд╕рдореНрдмрдиреНрдзрдорд╛ рднрдПрдХреЛ рдмрд┐рдХреГрддреА рд░ рдмрд┐рд╕рдЩреНрдЧрддреАрд▓реЗ рдХрддрд┐ рдмрд╛рд▓ рдмрдЪреНрдЪрд╛рд╣рд░реБ рдЕрдирд╛рде рдЫрди ред  рдкрдвреНрди  рдкрд╛рдЙрдиреБ рднрдиреЗрдХреЛ рдмрд╛рд▓ рдЕрдзрд┐рдХрд╛рд░ рд╣реЛ рддрд░ рдиреЗрдкрд╛рд▓рдорд╛ рдХрддреНрддреА рдмрдЪреНрдЪрд╛рд╣рд░реБрд▓реЗ рдЕрд╕рд▓ рдЕрднрд┐рднрд╛рд╡рдХ рдирднрдПрдХрд╛ рдХрд╛рд░рдгрд▓реЗ рд╕реНрдХреБрд▓ рдЬрд╛рди рдкрд╛рдПрдХрд╛ рдЫреИрдирди ред  рдпрд╢ рдЯреЗрд▓рд┐ рд╕рд┐рд░рд┐рдпрд▓рдХреЛ рдХрдорд▓рд╛ рднрдиреНрдиреЗ рдкрд╛рддреНрд░ рдЬрд╕реНрд▓реЗ рдкрдвреНрдирдХреЛ рд▓рд╛рдЧрд┐ рдЖрдлреИрд▓реЗ рдкрдирд┐ рдзреЗрд░реИ рд╕рдВрдШрд░реНрд╖ рдЧрд░реЗрдХреА рд╣реБрдиреНрдЫрд┐рди  рд░ рдЕрд╕рд▓ рдЕрднрд┐рднрд╛рд╡рдХ рдирдкрд╛рдПрдХрд╛ рддреНрдпрд╕реНрддрд╛ рдмрдЪреНрдЪрд╛рд╣рд░реВрд▓рд╛рдИ рднреЛрд▓рд┐рдХрд╛ рджрд┐рдирдорд╛ рдкрдврд╛рдЙрдиреЗ рдПрдЙрдЯрд╛ рдЫреБрдЯреНрдЯреИ рдЕрднрд┐рдпрд╛рдирдорд╛ рд▓рд╛рдЧреНрдиреЗ рдЫрд┐рди, #aalapstudio    #Kamala_Ghimire#Suprim_mallathakuri#tika_sanu рдкрд╛рддреНрд░ рдкрд░рд┐рдЪрдп рдмрд┐рд╢рд╛рд▓ рдкрд╣рд╛рдбреА - рд╕реБрд░реНрдп рдкреНрд░рд╢рд╛рдж рд╣рд┐рдЙрд╡рд╛рд▓рд╛ рдЧреМрддрдо - рд╕реЗрддреА рд╕рдмрд┐рди рдмрд╛рд╕реНрддреЛрд▓рд╛ - рджрд┐рд░реНрдШ рдкреНрд░рд╕рд╛рдж рд╕рдкрдирд╛ рд╢реНрд░реЗрд╖реНрда - рдзрд░реНрддреАрдорд╛ рдЯрд┐рдХрд╛ рд╕рд╛рдиреБ- рдЪрд╛рдБрджрдиреА рдЬреНрдЮрд╛рдиреБ рд╕рд┐рдВрд╣ - рдЪрдиреНрджреНрд░рдорд╛ рд╢реБрднрдо рдЧреМрддрдо -рд░рд╡рд┐ рдХрдорд▓рд╛ рдШрд┐рдорд┐рд░реЗ - рдХрдорд▓рд╛ рд╕реБрдкреНрд░рд┐рдо рдорд▓реНрд▓ рдардХреБрд░реА - рд╕реБрдкреНрд░рд┐рдо рдкреНрд░рдХрд╛рд╢ рд░реЛрдХрд╛ -рд╣реБрдЗрдХреЗ рдЖрд╢рд╛ рдмрд┐рд╢реНрд╡рдХрд░реНрдорд╛ - рдЖрд╢рд╛ рдмрд┐рдмреЗрдХ рдзрд┐рддрд╛рд▓ - рдЕрдХрд▓реЗрд╢ рдЧреЛрд╡рд┐рдиреНрдж рд░рд╛рдЗ - рддрд╛рд▓реБ рд╕рд┐рддрд╛рд░рд╛рдо рдкрд░рд┐рдпрд╛рд░ - рд╕рд┐рддреЗЁЭРОЁЭРоЁЭРл ЁЭРЛЁЭРвЁЭРзЁЭРдЁЭРм ЁЭРйЁЭРлЁЭРиЁЭРоЁЭРЭЁЭРеЁЭР▓ уАРя╗┐рдХрддреНрддрд┐уААрд░рд╛рдореНрд░реЛуААрджрдорд╛рдИрдХреЛуААрдЫреЛрд░реЛуАСhttps://www.youtube.com/watch?v=0R1y6...уАРя╗┐рдХрдорд▓рд╛уААрдШрд┐рдорд┐рд░реЗрдХреЛуААрджреЛрд╕реНрд░реЛуААрдЧреАрддуААрдЬрд┐рдиреНрджрдЧреАуАСhttps://www.youtube.com/watch?v=itWCF...уАРя╗┐рд╕реБрдирдорд╛рдпрд╛уАСhttps://www.youtube.com/watch?v=FATFs...уАРя╗┐рдорд╛рдпрд╛рдХреЛуААрдЪрд┐рдиреЛуААрднрд╛уААрезуАСhttps://www.youtube.com/watch?v=rhtAo...уАРя╗┐рдорд╛рдпрд╛рдХреЛуААрдЪрд┐рдиреЛуААрднрд╛уААреиуАСhttps://www.youtube.com/watch?v=4hN98...уАРя╗┐рдорд╛рдпрд╛рдХреЛуААрдЪрд┐рдиреЛуААрднрд╛уААрейуАСhttps://www.youtube.com/watch?v=5NSlp...уАРя╗┐рдорд╛рд░реНрдорд┐рдХуААрдЧреАрддуААрдкреБрдЧреЗрдиуААрдордирд╛рдХреЛуААрдзреЛрдХреЛуААрдкреБрдЧреЗрдиуАСhttps://www.youtube.com/watch?v=JPJYi...уАРя╗┐рдХрд╕реНрддреЛуААрдореЗрд░реЛуААрдЬрд┐рдиреНрджрдЧрд┐уАСhttps://www.youtube.com/watch?v=ymMY9...уАРя╗┐рд▓рд╛рд╣реБрд░реЗуААрдкрд▓реНрдЯрдирдХреЛуАСhttps://www.youtube.com/watch?v=D-KYO...уАРя╗┐рд╕рдореНрдЭрдирд╛уААрдЫуААрдзреЗрд░реИуАСhttps://www.youtube.com/watch?v=GfWHZ...уАРя╗┐рдЭрдоуААрдЭрдоуААрдкрд╛рдиреАуАСhttps://www.youtube.com/watch?v=Zn2l-...уАРя╗┐рддрд┐рдореНрд░реЛуААрдкрддреАуААрдореЗрд░реЛуААрдкрд┐рд░рддреАуАСhttps://www.youtube.com/watch?v=_sTc1..уАРя╗┐рд╕рд┐рдиреНрджреБрд░ ЁЯЖВЁЯЕ╕ЁЯЕ╜ЁЯЕ│ЁЯЖДЁЯЖБуАСhttps://www.youtube.com/watch?v=Q81gk...ЁЯОм CAST:- SABIN BASTOLAHIUWALA GAUTAM BISHAL PAHADISAPANA SHRESTHA DOLRAJ NEUPANETIKA SANUSHUBHAM GAUTAMKAMALA GHIMIRE SUPRIM MALLA THAKURI GYANU SINGH PRAKASH ROKA BIBEK DHITAL AASHA BISHWAKARMA HARISH DHITALBISHAL BARAL MADAN NEUPANE ЁЯОм MUA:- MADAM NEUPANE ЁЯОм KITCHEN MANAGER:- RADHA BISTA LAXMI SHRESTHA TEAMЁЯОм TRASPORT:- STARJOHN TRASPORT TEAM ЁЯОм ASSISTANT DIRECTOR:- PRAKASH ROKAЁЯОм PRODUTION MANAGER:- GEETA RASAILIKAMAL SHRESTHA  ЁЯОм CINEMATOGRAPHER:- BIRENDRA PARIYAR  ЁЯОм EDITOR/GRAPHICS/COLOR:- ANIL BIST PYUTHANI тЩм RECORDIST:- REM SUNARтЩм STUDIO:- AALAP STUDIO SAMAKHUSI, KATHMANDU 9849155097, 9861717676тЩм SINGER:- TIKA PUNSUPRIM MALLA THAKURI PUJA DEVKOTA JHALAK SANGEETAMтЩм FLUTE:-RATNA BISHWAKARMAтЩм SARANGEE:-DHARMA GANDHARWA KAMAL KUMAR BISHWAKARMA тЩм THE LEAF:-JHALAK SANGEETAM тЩмЁЯОмSTORY/ LYRICS/MUSICJHALAK SANGEETAM ЁЯОм PRODUCERS:- BASHANTA SHISHIRGEETA RASHAILISUNITA NEPALIPRITI MANGOLЁЯОм POST PRODUCTION:- AALAP STUDIO, SAMAKHUSI9849155097, 9861717676SPECIAL THANKS BASANTA SHISIRTULASI GHIMIRE RAJU PARIYARSAJJAN HAMALNANDA BASYAL RAMESH BG BIJAYA BHAKTA SHRESTHA DINESH SHRESTHA SUMAN PANDIT BAIRAGI AASHARAM FAAJU ┬й&p  Aalap Studio, 2022-----------------------------------------------For instant queries, you can make a call to 9849155097You can mail us at :- aalaprecordingstudio@gmail.comSubscribe us YouTube:- http://www.youtube.com/c/AalapRecordi.... find us on Facebook:- https://www.facebook.com/profile.php?....Website:- http://www.aalapstudio.com/тАЛтАЛтАЛрдЧреАрдд рд╕рдЩреНрдЧреАрддрдорд╛, рднрд╛рдХрд╛ рд╢реНрд░реАрдЬрдирд╛, рд╢рдмреНрдж рд▓реЗрдЦрди, рдПрд░реЗрдиреНрдЬ, рдЧреАрдд рд░реЗрдХрд░реНрдбрд┐рдЩ, рдорд┐рдХреНрд╕рд┐рдЩ рдорд╛рд╕реНрдЯрд░рд┐рдЩреНрдЧ, рдореНрдпреВрдЬрд┐рдХ рднрд┐рдбрд┐рдпреЛ рдЫрд╛рдпрд╛рдЩреНрдХрди, рднрд┐рдбрд┐рдпреЛ рд╕рдореНрдкрд╛рджрди, рдЕрдкреНрд▓реЛрдб рдЧрд░реНрдиреБ рдкрд░реЗрдорд╛ рд╣рд╛рдореАрд▓рд╛рдИ рд╕рдореНрдЭрдиреБрд╣реЛрд╕ рд╕рдореНрдкрд░реНрдХ :- рдЭрд▓рдХ рд╕рдЩреНрдЧреАрддрдо репреорекрепрезрелрелрежрепрен, репреоремрезренрезренремренрем"
B7OUHcz2tEw,"Lets Dance Chotu Motu - Kisi Ka Bhai Kisi Ki Jaan | Salman Khan | Yo Yo Honey Singh, Devi Sri Prasad",2023-04-18T14:00:26Z,UCFFbwnve3yF62-tVXkTyHqg,Zee Music Company,10,23.27.04,15624316,547957,47384,False,False,"ЁЯСЙЁЯП╗ SUBSCRIBE to Zee Music Company - https://bit.ly/2yPcBkS To Stream & Download Full Song: JioSaavn - https://bit.ly/3LcnqQwResso - https://bit.ly/3LfJNVdiTunes - https://apple.co/3mKDSyfApple Music - https://apple.co/3mKDSyfAmazon Prime Music - https://amzn.to/41CFA3sWynk Music - https://wynk.in/u/i5OzAcCrLYouTube Music - https://bit.ly/3KW3xfmSong: Lets Dance Chotu MotuSingers: Salman Khan & Devi Sri PrasadRap: Yo Yo Honey SinghFemale Vocals: Neha BhasinMusic Composer: Devi Sri PrasadHookline Lyrics: Devi Sri PrasadMusicians:-Keyboards: KP & KalyanAdditional Keyboards: KalyanRhythm: KalyanAlbum Mixed & Mastered by A. Uday Kumar at тАЬDSP STUDIO - CHENNAIтАЭAlbum Recorded by A. Uday Kumar, T. Uday Kumar & Suresh Kumar TaddiOrchestra In-Charge: MuruganStudio Asst: Pugalendhi, Bharat & DhinakaranAlbum Co-ordinator: B. ManikandanStarring: Salman Khan, Venkatesh Daggubati & Pooja HegdeProduction House: Salman Khan Films in Association With Zee StudiosDirected by: Farhad SamjiProduced by: Salma Khan#LetsDance #KisiKaBhaiKisiKiJaanMusic on Zee Music CompanyConnect with us on :Twitter - https://www.twitter.com/ZeeMusicCompanyFacebook - https://www.facebook.com/zeemusiccompanyInstagram - https://www.instagram.com/zeemusiccompanyYouTube - http://bit.ly/TYZMC"
q3aF_yuVbvk,"Today news ЁЯФ┤ nepali news | aaja ka mukhya samachar, nepali samachar live | Baishak 11 gate 2080",2023-04-23T23:15:02Z,UC09hwXZEtHcScFWebDsj7cA,samacharpati,25,23.27.04,133654,4021,253,False,False,"Nepali news - today news | aaja ka mukhya samachar, nepali samachar live | Baishak 11 gate 2080,nepali news today, nepali news live, nepali news today live, nepali news update today, nepali news today kantipur, nepali news 24, nepali news today live tv, nepali news channel, nepali news live now, nepali news kantipur live today, nepali news 24 live, nepali news samachar, nepali news update, nepali news latest,today news, today news nepal, today news live, today news nepal live, today news nepal live, today news live nepali, today nepali news, today's news, today's nepali news, nepali samachar, nepali samachar today, nepali samachar lvie, nepali samachar news, nepali samachar aaj ka, nepali samachar nepali samachar, nepali samachar aajako nepali samachar, nepali samachar taja, nepali samachar today live, nepali samachar kantipur, nepali samachar taja khabar, nepali samachar live news, nepali samachar video, nepali samachar naya, nepali samachar today news, aaj ka mukhya samachar, aaj ka mukhya samachar live, aaj ka mukhya samachar taaja, aaj ka mukhya samachar hai, aaj ke mukhya samachar nepali, aaj ka mukhya samachar news, aaj ke mukhya samachar aaj tak, aaj ka mukhya samachar samachar, aaj ka mukhya samachar haru, aaj ke mukhya samachar live, aaj ka mukhya samachar taaja news, aaj ka mukhya samachar nepal,samachar, samachar news, samachar live, samachar samachar, samachar nepali, samachar aaj tak, samachar pati, samachar today, samachar aaj ka, samachar dijiye, samachar pati news, samachar pati news today, samachar patra, samachar song, samachar live aaj tak, nepali news,today news, samachar, news,nepali samachar,news today,nepal news,nepali news today,today nepali news,news nepal,samachar today in nepali,nepal news today,news nepali,nepal samachar,aajako taja khabar,news nepali news today,samachar nepali,aajako samachar,new nepali news,nepali khabar,nepali news live,samachar pati,news today nepal,samacharpati,samacharpati news,aaja ka mukhya nepali samachar,Fatafat taja KhabarOur Other Some Playlist.Health Tips/рд╣реЗрд▓реНрде рдЯрд┐рдкреНрд╕: ЁЯСЙ https://youtube.com/playlist?list=PLBg_ZbC3CTQ7V6kpfRfhYZiE0q2MBX4hhLatest News/рддрд╛рдЬрд╛ рд╕рдорд╛рдЪрд╛рд░ :ЁЯСЙ https://youtube.com/playlist?list=PLBg_ZbC3CTQ62ghN0iWXg-WEFF9Tz8OsjLatest Video Footage/рднрд░реНрдЦрд░реИрдХреЛ рддрд╛рдЬрд╛ рднрд┐рдбрд┐рдпреЛ рд╣реЗрд░реНрдиреБрд╣реЛрд╕ :ЁЯСЙ https://youtube.com/playlist?list=PLAsVa-hiw2gow0QqhnDncwKxZDkj9lf6MJoin Samacharpati.com on Viber :ЁЯСЙ https://invite.viber.com/?g2=AQBNmPD2z5VbzUkc2G8SbFXmsBr4aUYPnOjLHXqsV7Y6iIfPovVTnxdzQEFhfm0LLatest News : https://samacharpati.comFor Advertisements : info@samacharpati.comInstagram: https://www.instagram.com/samacharpatiFacebook: https://www.facebook.com/samacharpatiTikTok: https://www.tiktok.com/@samacharpatiTwitter: https://www.twitter.com/samacharpatiProduced By: Pokhara Media Club Pvt.Ltd/Samachar PatiPresented By: Pralhad Chandra Ghimire Video Edited By: Robart ReturnsAbout Samacharpati : ЁЯСЙ https://youtube.com/@samacharpati/about#nepalinews #aajakosamachar #todaysnews #todaynews #newsofnepal #samacharpati #samacharpatinews #todaynepalinews #news #samachar #pralhadchandraghimire #pralhad"
os9wadNHy5w,"Tool Items!ЁЯШНNew Gadgets, Smart Appliances, Kitchen Utensils/Home Inventions #shorts #gadgets",2023-04-08T04:35:38Z,UCeuXd6PLk_t2WGIhPMvkUSA,Tool Items,22,23.27.04,116819253,668549,1144,False,False,
4YGII2-yWnE,Funniest game of SMASH ЁЯШВ,2023-04-13T15:46:10Z,UCcILXXthGExGeKAQLAIUaFQ,Pongfinity,17,23.27.04,32853354,1015821,382,False,False,"SUBSCRIBE to Pongfinity тЦ║ http://bit.ly/PongfinitySubOfficial Pongfinity Products тЦ║ https://pongfinity.store/Buy our clothing (shirts, hoodies etc) тЦ║ https://fanjoy.co/pongfinityCheck out our 2nd channel for match videos and more! тЦ║ http://bit.ly/PongfinityPlusDownload our NEW Pongfinity Duels 1v1 Multiplayer mobile game for FREE:Android: http://bit.ly/PongfinityDuelsAndroidiOS: http://bit.ly/PongfinityDuelsAppleHang out with us on social media:тЦ║ Facebook (@Pongfinity): http://bit.ly/PongfinityFBтЦ║ Instagram (@Pongfinity): http://bit.ly/PongfinityIGтЦ║ TikTok (@Pongfinity): https://bit.ly/PongfinityTikTokYou can reach us at: media@pongfinity.com"
ab_UPWqbsMs,Tag someone who FARTS ЁЯТи a lot ЁЯШЕ #ramadan #shorts #comedy #awezdarbarshorts,2023-04-11T10:09:51Z,UCEkEWLr6Msc311z29MV5Ayg,Awez Darbar,24,23.27.04,25043606,0,2594,False,True,
5nAytRXh7Tk,Kaamwaali Aunty тШая╕ПЁЯШ▒ Bhoot Piche Piche Aagaya ЁЯШУ #shorts #kaamwalibai,2023-04-10T10:16:29Z,UC_cdxikvfl_ntmtW6loibKA,Jomy Production,24,23.27.04,28254580,831523,887,False,False,
imCOAyoKo1w,I BUILT A HOUSE IN JUNGLE,2023-04-15T13:46:35Z,UCY6s6soycjPFPAajxbmrmBg,Techno,24,23.27.04,9083154,736730,43711,False,False,"I BUILT A HOUSE IN JUNGLE#Jungle #Techno Business Email : technogamerzofficial@gmail.comAbout : Hey! My name is Ujjwal Aka Techno Gamerz, I started my YouTube journey from gaming, But now it's time to do some IRL stuff. Make sure to subscribe for Awesome videos!"
e2NxbcJq7Xw,Naagin 6 | рдирд╛рдЧрд┐рди 6 | Episode 125 | 23 April 2023,2023-04-23T18:30:34Z,UC55IWqFLDH1Xp7iu1_xknRA,Colors TV,24,23.27.04,2598040,57838,719,False,False,"Naagin 6 | рдирд╛рдЧрд┐рди 6 | Episode 125 | 23 April 2023Prathna overhears Surpreet's scheme to kidnap Meher and stages an accident to cover her death. Meanwhile, Meher takes her Naagin form and rescues some kids who are in danger. Will Prathna reach in time to unmask her daughter's true identity?Naagin, the saga of love and revenge, sacrifice. This supernatural show traces the lives of 'ichchadhari' naagins. Watch on, as every season, the Naagin fights evil and keeps the ultimate source of power safe. Watch more videos: https://www.youtube.com/playlist?list=PLcC6hSpO26Ktuu7j_1s3Fc0lle99DksNHTo subscribe to this channel go to: http://www.youtube.com/subscription_center?add_user=colorstvFollow us on: Facebook: https://www.facebook.com/ColorsTVInstagram: https://www.instagram.com/colorstv/#ColorsTV #Naagin6 #рдирд╛рдЧрд┐рди6The accuracy, completeness, currency and/or suitability of the above video description is not endorsed by its licensor or broadcaster or the Channel. They shall not be liable for loss and/or damage arising from the video description."
6XTJXHDRO_M,Best Trick To Get New ShoesЁЯдг@Sachinsainishorts  #shorts #ytshorts #manishsaini,2023-04-08T08:30:01Z,UCZtLc3mHfOq9Oo9dz7tVmKQ,Manish saini,23,23.27.04,31125680,663237,257,False,False,
3NLor5M6YXk,Nepali Serial Juthe (рдЬреБрдареЗ) Episode 107 || April 13- 2023 By Raju Poudel Marichman Shrestha,2023-04-13T15:15:10Z,UCgJiJkUTIO0gOhsjsgGZL6Q,Master TV,24,23.27.04,2560675,62894,1371,False,False,"Master TV Presents:-Juthe is a social television serial that portrays a story about the Dalits emancipation movement against these oppression, the heroes of the movement and future vision for the emancipation. It is aired in Himalaya Television at 8:00 PM and in YouTube at 9:00 PM every Wednesday.Nepali Serial Juthe (рдЬреБрдареЗ) Episode 107 || April 13- 2023 By Raju Poudel Marichman ShresthaSpecial ThanksNarendra Shrestha (Pokhara)Kushal Thapa (Pokhara)Sharwan Shrestha (Texas America)Anjana Joshi (Texas America)Actor Rabi GiriBidhya KarkiRambabu RegmiMukunda MainaliSarmila SharmaShree Prasad ThapaRaju PoudelMarichman ShresthaRaju KarkiUjjwol KhadkaUnisha DhunganaSowinika BastolaRukmila AdhikariAnamika LamichhaneLightShiva Parajuli MusicianYogesh KajiAalap Voice : Pasang Doma Sherpa & Binay KarkiBackground Music by : Binay Karki Aarohi EntertainmentAnamnagar Ktmbinaytwo@gmail.comCamera Ghanshyam PokharelEditorRabin BhattaSub-EditorSarita  GautamAshok ChaudharyMarkup ArtistNirmala AcharyaWriter/ DirectorRaju Poudel, Marichman Shresthaрд╕рдорд╛рджрд░рдгреАрдп рджрд░реНрд╢рдХрдмреГрдиреНрджрд╣рд░реБрдорд╛ рдирдорд╕реНрдХрд╛рд░ рд╣рд╛рдореНрд░реЛ рдХрд╛рд░реНрдпрдХреНрд░рдо рдЬреБрдареЗ рдкреНрд░рддрд┐ рд╕рд╛рдорд╛рдЬрд┐рдХ рд╕рдиреНрдЬрд╛рд▓рдорд╛ рдЙрдареЗрдХрд╛ рд╡рд┐рд╡рд┐рдз рдкреНрд░рддрд┐рдХреНрд░рд┐рдпрд╛рд▓рд╛рдИ рдордзреНрдпрдирдЬрд░ рдЧрд░реНрджреИ рд╣рд╛рдореНрд░реЛ рдЯреАрдо рд░ рд░рд╛рд╖реНрдЯреНрд░рд┐рдп рджрд▓рд┐рдд рдЖрдпреЛрдЧ рд╕рдВрдЧ рдкрд░рд╛рдорд░реНрд╕ рдЧрд░реНрджреИ рдЕрдЧрд╛рдбрд┐ рдмрдвреНрдиреЗ рдирд┐рд░реНрдгрдп рднрдПрдХреЛ рдЫ ред рдпрд╕ рд╕рдордиреНрд╡рдпрдХрд╛ рд▓рд╛рдЧрд┐ рд░рд╛рд╖реНрдЯреНрд░рд┐рдп рджрд▓рд┐рдд рдЖрдпреЛрдЧ рдкреНрд░рддрд┐ рд╡рд┐рд╢реЗрд╖ рдзрдиреНрдпрд╡рд╛рдж рдЬреНрдЮрд╛рдкрди рдЧрд░реНрджрдЫреМрдВ#Juthe #JutheEpisode107 #JutheNepaliSocialSerial┬й Master TV--------------------------------------------Social Link:-YouTube:- https://tinyurl.com/ybp5lm25G+:- https://tinyurl.com/y9sc4yy4рдпрд╕ рдЪреНрдпрд╛рдирд▓ рдорд╛ рд░рд╣реЗрдХрд╛ рдЧреАрдд, рд╕рдВрдЧреАрдд рддрдерд╛ Video рд╣рд░реБ рдХрдкрд┐, Download рдЧрд░реА рдЕрдиреНрдп Channel рдорд╛ upload рдЧрд░реЗрдХреЛ рдкрд╛рдПрдорд╛ рдкреНрд░рдЪрд╛рд▓рд┐рдд рдХрд╛рдиреБрди рдмрдореЛрдЬрд┐рдо рдХрдбрд╛ рднрдиреНрджрд╛ рдХрдбрд╛ рдХрд╛рд░рдмрд╛рд╣реА рдЧрд░рд┐рдиреЗрдЫ ред  Embedding to a website is allowed."
ZoJ8J7VmtTM,Children's lives saved from hypocrite #vijaykumarviner #emotional #motivation #humanity,2023-04-20T03:23:52Z,UCfIpFdLEnTfkXjcwsiO4dAA,Vijay Kumar Viner Vlogs,24,23.27.04,6128308,240814,47,False,False,
h0nnq5vwCgc,Steph casually found a dead spot on the court ЁЯШп | #shorts,2023-04-04T03:03:07Z,UCiWLfSweyRNmLpgEHekhoAg,ESPN,17,23.27.04,32557214,1144845,4996,False,False,Steph Curry casually found a dead spot on the court ЁЯШп #shorts (via @nbcsportsauthentic)тЬФя╕П Subscribe to ESPN+ http://espnplus.com/youtubeтЬФя╕П Get the ESPN App: http://www.espn.com/espn/apps/espnтЬФя╕П Subscribe to ESPN on YouTube: http://es.pn/SUBSCRIBEtoYOUTUBEтЬФя╕П Subscribe to NBA on ESPN on YouTube: http://bit.ly/SUBSCRIBEtoNBAonESPNтЬФя╕П Watch ESPN on YouTube TV: http://es.pn/YouTubeTV#stephcurry #warriors #NBA
