video_id,title,publish_time,channelId,channel_title,category_id,trending_date,views,likes,comment_count,comments_disabled,ratings_disabled,description
QXQQAsIhHMw,"ROSALÍA, Rauw Alejandro - BESO (Official Video)",2023-03-24T04:00:06Z,UCy2bCk5KnIfjmWYFHMZcd5w,RosaliaVEVO,10,23.27.04,43774348,980175,17496,False,False,"Official video for “BESO” by ROSALÍA & Rauw AlejandroListen & Download ‘RR’ out now: https://rosalia.lnk.to/rosaliayrauwShop the official store: https://rosalia.lnk.to/merchAmazon Music - https://rosalia.lnk.to/rosaliayrauw/amazonmusicApple Music - https://rosalia.lnk.to/rosaliayrauw/applemusicDeezer - https://rosalia.lnk.to/rosaliayrauw/deezeriTunes - https://rosalia.lnk.to/rosaliayrauw/itunesSoundCloud - https://rosalia.lnk.to/rosaliayrauw/soundcloudSpotify - https://rosalia.lnk.to/rosaliayrauw/spotifyTidal - https://rosalia.lnk.to/rosaliayrauw/tidalYouTube Music - https://rosalia.lnk.to/rosaliayrauw/youtubemusicLyrics(Rosalia)Ya yo necesito otro beso Un de esos que tu me dasEstar lejos de ti es el infierno Estar cerca de ti es mi pazY es que amo siempre que llegas Y odio cuando te vasYo me voy contigo a matar No me dejes sola¿Pa donde vas?¿A donde vas? (Rauw)Ven pa aca (Rosalia)¿Pa donde vas? (Rauw)Uuooh UuoohSi me bailas me lo das to’Uuooh UuoohYa tamo solos y se quita to’Mis sentimientos no caben en esta pluma, como decirte?Tu eres el exponente infinito la “x” y la “+” te queda pequeña la lunaY aunque este lejosTu eres la persona más cerca de mi Si mi cel se va a apagarSolo te aviso a ti Si antes hubo otra vida de tus aguas bebí, conocerte debi(Rosalia)Lo mejor que tengoEs el amor que me das Huele a tabaco y melón Y a domingo en la ciudadSi tu me esperasEl tiempo puedo doblar El cielo puedo amarrar Y dartelo entero(Rauw)Yo quiero que me des otro beso Uno de eso que tu me das Estar lejos de ti es el infierno Estar cerca de ti es mi pazY es que amo siempre que llegas Y odio cuando te vasYo me voy contigo a matar  No me dejes solo¿Pa donde vas?¿A donde vas? (Rosalia)Fumas como si te fueran a echar por fumar Bailas como sé que se movería un Dios al      bailarY besas como que siempre hubieras sabido besarY nadie a ti te tuvo que enseñarLo mejor que tengoEs el amor que me das Huele a tabaco y melón Y a domingo en la ciudad (Rauw)Y si tu me esperasEl tiempo puedo doblar, el cielo puedo amarrar y dartelo entero(Rosalia & Rauw)Ya yo necesito otro beso Un de eso que tu me dasEstar lejos de ti es el infierno Estar cerca de ti es mi pazY es que amo siempre que llegas Y odio cuando te vasYo me voy contigo a matarNo me dejes sola¿Pa donde vas?¿A donde vas?Follow ROSALÍA Facebook - https://www.facebook.com/rosalia.vtInstagram - https://www.instagram.com/rosalia.vt/Twitter - https://twitter.com/rosaliaTikTok - https://www.tiktok.com/@rosaliaFollow Rauw Alejandro Facebook - https://www.facebook.com/rauwalejandroInstagram - https://www.instagram.com/rauwalejandro/Twitter - https://twitter.com/rauwalejandroTikTok - https://www.tiktok.com/@rauwalejandrohttps://www.rosaliayrauw.com/#ROSALÍA #RauwAlejandro #RR"
BOQcUTfA1aE,CHUTEIRA DE ANÃO ZOADA ⚽️,2023-04-06T21:15:31Z,UC2pPQq_L7pfpFfzl98U-0_w,Gabriel Tarobinha,24,23.27.04,3304247,219235,80,False,False,
iuk77TjvfmE,Marvel Studios’ The Marvels | Teaser Trailer,2023-04-11T12:46:57Z,UCvC4D8onUfXzvjTOM-dBfEA,Marvel Entertainment,24,23.27.04,18322636,514440,67421,False,False,"Teaming up changes e̶v̶e̶r̶y̶t̶h̶i̶n̶g̶ everyone.Captain Marvel, Ms. Marvel and Monica Rambeau return in Marvel Studios' #TheMarvels, only in theaters November 10.► Watch Marvel on Disney+: https://bit.ly/2XyBSIW► Subscribe to Marvel on YouTube: http://bit.ly/WeO3YJFollow Marvel on Twitter: ‪https://twitter.com/marvelLike Marvel on Facebook: ‪https://www.facebook.com/marvelWatch Marvel on Twitch: https://www.twitch.tv/marvelReward your Marvel fandom by joining Marvel Insider!Earn points, then redeem for awesome rewards.Terms and conditions apply. Learn more at https://www.marvel.com/insider?Osocial=YT&CID=MarvelInsiderFor even more news, stay tuned to:Tumblr: ‪http://marvelentertainment.tumblr.com/Instagram: https://www.instagram.com/marvelPinterest: ‪http://pinterest.com/marvelofficialReddit: http://reddit.com/u/marvel-official"
15VkQ4D76gE,Did She Really Cut Her Hair?!😅 I'm Not Surprised Why She Crafted A DIY Hairdresser! #shorts,2023-03-21T22:00:00Z,UCmQataFNBge-_HQJ7tpM3CA,Cool Tool Shorts,24,23.27.04,96748812,2542729,2229,False,False,Seems like the girls liked this diy craft!#craft #gadget #tiktok
YudHcBIxlYw,JISOO - ‘꽃(FLOWER)’ M/V,2023-03-31T04:00:14Z,UCOmHUn--16B90oW2L6FRR3A,BLACKPINK,10,23.27.04,164714989,8490106,1157805,False,False,"JISOO - ‘꽃(FLOWER)’ ABC 도레미만큼 착했던 나그 눈빛이 싹 변했지 어쩌면 이 또한 나니까 난 파란 나비처럼 날아가잡지 못한 건 다 네 몫이니까활짝 꽃피웠던 시간도 이제 모두내겐 lie lie lie 붉게 타버려진 너와 나난 괜찮아 넌 괜찮을까구름 한 점 없이 예쁜 날꽃향기만 남기고 갔단다꽃향기만 남기고 갔단다  You and me, 미칠 듯이 뜨거웠지만처참하게 짓밟혀진 내 하나뿐인 라일락 난 하얀 꽃잎처럼 날아가잡지 않은 것은 너니까살랑살랑 부는 바람에 이끌려봄은 오지만 우린 bye bye bye  붉게 타버려진 너와 나난 괜찮아 넌 괜찮을까구름 한 점 없이 예쁜 날꽃향기만 남기고 갔단다꽃향기만 남기고 갔단다 이젠 안녕 goodbye뒤는 절대 안 봐미련이란 이름의 잎새 하나봄비에 너에게서 떨어져꽃향기만 남아 꽃향기만 남기고 갔단다More about BLACKPINK @http://www.blackpinkofficial.com/jisoohttp://www.youtube.com/BLACKPINKOFFICIALhttps://www.instagram.com/BLACKPINKOFFICIALhttp://www.facebook.com/BLACKPINKOFFICIALhttps://twitter.com/BLACKPINK#JISOO #지수 #BLACKPINK #블랙핑크 #FIRSTSINGLEALBUM #ME #TITLE #꽃 #FLOWER #MV #YG"
